,portrait_50,categories2,profile_type,title,skills,country,description,name,last_activity,rate,member_since,portfolio_items_count,id,test_passed_count,feedback
161,https://odesk-prod-portraits.s3.amazonaws.com/Users:alyssa-foley:PortraitUrl_50?AWSAccessKeyId=1XVAX3FNQZAFC9GJCFR2&Expires=2147483647&Signature=07FDPOKkeD9DDitcTJ5xmpMEddg%3D&1483862179656700,Writing,Independent,"Writer, Blogger, Editor",writing--blog-writing--ap-style-writing--editing--proofreading--english-proofreading--english-grammar--english-punctuation--english-spelling,United States,"I am a native English speaker. I have an associate's degree in media arts and I am pursuing a bachelor's degree in journalism. I am experienced with turning around high-quality articles on deadline, I was a reporter and editor-in-chief of my college student newspaper for almost two years. I have written informative reports, feature stories, and profile pieces on a wide variety of subjects for a diverse audience of 60 thousand readers. At my last internship, I produced and managed a blog which aligned with the organization's voice and message, and it was sharply tailored to the organization's target audience demographics.  I can write on a variety of subjects and I am willing to conduct extensive research to ensure my writing is top-quality. I'm also experienced working as editor and proofreader on tight deadlines. As editor-in-chief, I ensured the quality of all published articles including those written by non-native English speakers. ",Alyssa Foley,2017-02-20,25.0,"January 8, 2017",0,https://www.upwork.com/freelancers/_~0110e6917ac4dadc2b,0,0.0
162,https://odesk-prod-portraits.s3.amazonaws.com/Users:jrent21:PortraitUrl_50?AWSAccessKeyId=1XVAX3FNQZAFC9GJCFR2&Expires=2147483647&Signature=%2Fl%2BY94sfJhx%2B0gs4nE%2B11krhkG4%3D&1478045224395359,Writing,Independent,Creative and Scientific Writer,mechanical-engineering--scientific-writing--creative-writing--proofreading,United States,"I am a 23 year old Mechanical Engineer looking to break into writing. While my interests have always been varied (comedy, music, science) my greatest skill has always been writing. I received a 5 out of 6 on the GRE writing portion, which is nearly unheard of for an engineering senior who had only written about 5 college essays in his life. It comes naturally to me, and I truly enjoy it. I also have a skill for proofreading and improving phrasing. I am passionate about writing and willing to learn whatever is necessary to be successful.",John Renteria,2017-02-17,10.0,"November 1, 2016",1,https://www.upwork.com/freelancers/_~013bcab52c0ac7275f,4,0.0
169,https://odesk-prod-portraits.s3.amazonaws.com/Users:oli_f:PortraitUrl_50?AWSAccessKeyId=1XVAX3FNQZAFC9GJCFR2&Expires=2147483647&Signature=isdU9fqxzdQ3RdZ50J9%2FC6HuNu0%3D&1485022962096897,Writing,Independent,Freelance Digital Marketing Specialist,seo--pay-per-click--email-marketing--inbound-marketing--social-media-marketing--direct-marketing--web-design--b2b-marketing--wordpress--blog-writing,United Kingdom,"I've had experience writing in numerous roles, creating exceptional content for clients big and small.",Oli Franklin,2017-02-20,15.0,"January 19, 2017",0,https://www.upwork.com/freelancers/_~0141fe462f20f9c6b6,0,0.0
170,https://odesk-prod-portraits.s3.amazonaws.com/Users:nathalia27:PortraitUrl_50?AWSAccessKeyId=1XVAX3FNQZAFC9GJCFR2&Expires=2147483647&Signature=Lm1Od%2B6H5Uz41ybgrGI1BTtMZ2c%3D&1442495835864997,Writing--Translation--Admin Support--Design & Creative--Accounting & Consulting,Independent,Writer,-,Indonesia,"A passionate traveler and a part-timer blogger who writes for online publications. I've never missed a deadline and can turn my hand to any kind of writing.Specialties: data entry, writing on travel, food/lifestyle, psychology, South East Asia, adventure travel",Nathalia H.,2017-02-24,12.0,"July 27, 2015",0,https://www.upwork.com/freelancers/_~01cf0491221ad9ef86,1,0.0
174,https://odesk-prod-portraits.s3.amazonaws.com/Users:rocshell71:PortraitUrl_50?AWSAccessKeyId=1XVAX3FNQZAFC9GJCFR2&Expires=2147483647&Signature=qbr1QrKtM7qAZhkSqHnIexYzurQ%3D&1485457381758267,Writing--Admin Support,Independent,Freelance writer / Blogger,writing--creative-writing--blog-writing--creative-and-talent--google-plus--wix--wordpress-multisite--translation-english-irish,United States,"I have a very creative mind. Sharing was never my strong suite for this introverted person. I had lost my love of writing when life happened. Just over two years ago. The words began to crawl out of my head to an almost ant-like composer of speed. I love the use of play on words. The imagination flowing into every orifice of your mind. Leaving no thought left behind. I have developed a blog using all of my experiences to guide my words. They are very deep in emotional connects to me. So sometimes they appear in poems.  I have become stronger in my writing since my first post. I will continue to grow in my post with every word. I like a challenge in the work field. I work very well under a deadline. I welcome constructive criticism as well as shown a better way. If it helps me grow in my writers walk. Then please help me run. Highlights of my personal projects are within attachments. I have also created my own website. I manage it, updating with new work often. I am eager to learn. Pick up things very quickly. Let me show you what I can do. ",Rochelle T.,2017-02-22,30.0,"December 27, 2016",11,https://www.upwork.com/freelancers/_~01c5c2546e3d11830b,3,5.0
189,https://odesk-prod-portraits.s3.amazonaws.com/Users:purnje:PortraitUrl_50?AWSAccessKeyId=1XVAX3FNQZAFC9GJCFR2&Expires=2147483647&Signature=2OofVAHIoufUo%2FwVabdi1wYzzRM%3D,Translation--Customer Service--Design & Creative--Admin Support--Writing--Accounting & Consulting,Independent,Excellent article writer.,article-writing--transcription--blog-writing--content-writing--creative-writing,Kenya,I am a talented freelance writer with more than one year of industrypractice.I have impeccable English writing skills and extensive knowledge of internet marketing.I deliver high quality original articles that I thoroughly researchand expertly craft to aptly meet the underlying objectives and am comfortable writing any niche including adult content.,Purity Ritah N.,2017-02-23,10.33,"February 3, 2014",2,https://www.upwork.com/freelancers/_~01c42ca8bcd5cfecf6,3,4.9426494346
190,https://odesk-prod-portraits.s3.amazonaws.com/Users:alexandra-plesa:PortraitUrl_50?AWSAccessKeyId=1XVAX3FNQZAFC9GJCFR2&Expires=2147483647&Signature=fT1CiIXtFAIMdQC03NRISFX1%2Fdg%3D&1439308354417238,Translation--Writing,Independent,"Article writer, Blog writer, Translator",article-writing--ebook-writing--personal-development--business-writing--reviews--blog-writing--translation-romanian-english,Romania,"I run on coffee and Wi-Fi. Content crafter for over two years. Former journalist. Fascinated by social media, personal development, and TV shows. I'm a full-time freelance content writer at the moment, dedicated to keeping clients happy and passionate about delivering quality content pieces on a regular basis. I've previously worked as a content writer for a company in Romania, which operates in an international environment exclusive for the US market. Consequently, I have the necessary experience and skills to research and write compelling content on a daily basis. Even though I'm not a native English speaker, I've been studying the language for more than 20 years.I have plenty of experience writing about personal development and business topics, and I'm particularly excited to write about anything TV or pop culture related. If you have an exciting project in mind, I'm eager to hear about it. Feel free to contact me at any time.",Alexandra Plesa,2017-02-24,25.0,"February 4, 2013",0,https://www.upwork.com/freelancers/_~01a1cac6187b1b490a,4,4.9994492497
192,https://odesk-prod-portraits.s3.amazonaws.com/Users:johnnyshamong:PortraitUrl_50?AWSAccessKeyId=1XVAX3FNQZAFC9GJCFR2&Expires=2147483647&Signature=H6oTuyffXAmjkqgDQvP27ogYP2s%3D&1446067828667606,Writing,Independent,Catchy copy with an eye for design,content-writing--social-media-marketing--graphic-design--proofreading--copywriting--editing--business-writing--article-writing--blog-writing--writing,United States,"I'm a content creator. That means I'll maintain your company's blog, produce a steady stream of engaging posts on any social network, develop marketing campaigns start to finish, or create an annual report or a business plan that delivers a polished, professional message, while being easy on the eyes at the same time.",John Shields,2017-02-24,14.0,"January 22, 2014",0,https://www.upwork.com/freelancers/_~016bec330bf2c48198,0,5.0
196,https://odesk-prod-portraits.s3.amazonaws.com/Users:gamche:PortraitUrl_50?AWSAccessKeyId=1XVAX3FNQZAFC9GJCFR2&Expires=2147483647&Signature=n4wujXV%2FWBw0ubunaogCbJqE2Tw%3D&1474538440539366,Translation--Writing--Sales & Marketing--Legal--Admin Support,Independent,"Translator, Virtual Assistant, SEO, Article Writer, Proofreader",translation--seo--proofreading--article-writing--internet-research--translation-english-french--translation-french-english--virtual-assistant,France,"I am a senior writer. I am a professional translator from English to French and French to English. I am motivated and talented for the translation and all types of writing projects. I have a good knowledge of EnglishI am also able to build websites and writing blog articles. I am available at any time for the translation, content writing and create Web sites.Finally, I have extensive experience as a virtual assaitante and in proofreading. I always respect work delays.",Viviane G.,2017-02-16,18.75,"May 20, 2015",0,https://www.upwork.com/freelancers/_~01240587e85bf8af45,5,3.7532923617
202,https://odesk-prod-portraits.s3.amazonaws.com/Users:winfrey_faith:PortraitUrl_50?AWSAccessKeyId=1XVAX3FNQZAFC9GJCFR2&Expires=2147483647&Signature=z%2Fhqiv%2BdHlgepnYfMTVqVReyPeY%3D&1466499750309121,Writing--Admin Support,Independent,Writer and Editor.,english-proofreading--english-grammar--grant-writing--cover-letter-writing--article-writing--editing--technical-writing--copywriting--ebook-writing,United States,"Let me help you find your voice.I have a B.A. in English and 18 years of experience as a writer, including copywriting, blogging, technical writing, sell sheets, and marketing communications. I worked in a big company for 5 years and then quit to start freelancing full-time. In my 13 years as a freelancer I have helped a great number of businesses improve their market share by improving their writing. I have created  copy for web pages, online ads, promotional e-mails, white papers, catalogs, brochures, postcards, etc. I am experienced in writing compelling and appropriate content for blogs, tweets and Facebook posts. My clients include advertising agencies, public relations firms, company marketing departments, large stores, marketing firms, magazines and creative agencies.",Winfrey Faith,2017-02-18,15.0,"June 16, 2016",1,https://www.upwork.com/freelancers/_~01582eba365bc84cc4,1,4.4943502825
209,https://odesk-prod-portraits.s3.amazonaws.com/Users:kimira_1012:PortraitUrl_50?AWSAccessKeyId=1XVAX3FNQZAFC9GJCFR2&Expires=2147483647&Signature=ZlbRfmhOU4iusgT1DGxwM%2ByOX2k%3D,Writing--Engineering & Architecture--Data Science & Analytics--Design & Creative--Accounting & Consulting--Admin Support,Independent,Curriculum developer | STEM Educator | Data Analytics | Writing,curriculum-development--data-science--content-writing,Singapore,"Over the last 2 years, I have developed a wide range of curriculum for K-12 classes in STEM topics. I have also worked widely with STEM enthusiasts and Makers from the community and developed and organized several family STEM workshops. I have also run several volunteer and facilitator training programmes. My core competence lies in the development of activities and training of facilitators. I also have a background in IT and computer Science and have experience in developing programming curriculum for schools and kindergartens.",Kiruthika C.,2017-02-13,25.0,"November 13, 2014",1,https://www.upwork.com/freelancers/_~0190f1ea165b084cfe,3,2.0
214,https://odesk-prod-portraits.s3.amazonaws.com/Users:drgru:PortraitUrl_50?AWSAccessKeyId=1XVAX3FNQZAFC9GJCFR2&Expires=2147483647&Signature=zzQEYU3Ktq5%2FwjKxquTV%2Bhxrrug%3D&1456692437552998,Writing--Admin Support,Independent,"Professional Writer, Blogger, Columnist",mobile-app-testing--reviews--privacy--internet-security--game-testing--product-descriptions--writing--ap-style-writing--news-writing-style--rpg-writing,Costa Rica,"I am a native speaker and a dedicated writer with 7 years of experience producing blog posts and articles of different styles. I write best about something that makes me tick:Cyber Security, Privacy, EncryptionPress ReleasesEmail Marketing PiecesRugged Industrial Computers/TabletsMedical Computers/TabletsWindows Software ArticlesMobile Apps and Games Reviews (Android)Mobile Apps and Games Descriptions, Q&A (Android if testing is required)Informational Articles and Event Reports News-StyleProduct Descriptions and ReviewsCopy for Tourism Websites'How To' and 'Top 10' ArticlesOpinion Articles (politics, culture)Human RightsTraveling, ExpatsExpat Living in Costa Rica Tips (real estate, medical service, education private and public, raising children, local food, culture, traditions)I am accessible, flexible and sometimes opinionated (who isn't?), but I know the value of adaptation. Living off of freelancing for this long has taught me a good deal about my learning and working capabilities, so I don't take up more than I can handle. I also prefer to steer clear of ""I need this yesterday"" deadlines because I like to take time doing my job with due diligence.I work alone and do not outsource.Thank you for taking your time to read this!",Daniela Quiros,2017-02-24,23.0,"August 16, 2013",4,https://www.upwork.com/freelancers/_~01f74ae533795bd228,0,5.0
215,https://odesk-prod-portraits.s3.amazonaws.com/Users:sctho:PortraitUrl_50?AWSAccessKeyId=1XVAX3FNQZAFC9GJCFR2&Expires=2147483647&Signature=PeBOfRxpPVnhrV%2Fry%2FM%2F%2F8PJu48%3D&1448281840389712,Writing,Independent,"Science, Media and Technology Specialist",blog-writing--content-writing--editorial-writing--editing--english-proofreading--proofreading,United Kingdom,"I'm a Marine Biogeochemistry PhD Student with particular interest in technology, media and sports as well as science. I've got a multitude of experience writing in a wide range of styles, including working to scientific publication standard in addition to on a more personal level in reviews, informational articles and blog posts. I'm keen to impress, hard working and highly adaptable with a desire to succeed in any job. I pride myself on top quality research, which brings about top quality copy. Outside of work I am a keen sportsman, gamer and musician. ",Seth Thomas,2017-02-24,17.0,"November 12, 2013",3,https://www.upwork.com/freelancers/_~01554131d9767ec3a2,0,4.9415171688
216,https://odesk-prod-portraits.s3.amazonaws.com/Users:nicole_hicks:PortraitUrl_50?AWSAccessKeyId=1XVAX3FNQZAFC9GJCFR2&Expires=2147483647&Signature=ROZX3KOwQe7oXd1RubR3eTpfV3A%3D&1467388307991005,Writing,Independent,English Nerd,english--english-spelling--copy-editing--editing--english-punctuation--english-grammar--english-proofreading--creative-writing--writing--fiction-writing,United States,"I am a freelance editor providing the virtual red pen to make fiction and nonfiction manuscripts alike stand above the bar. I work as a writing tutor at a community college and have worked as a contracted editor with a POD publishing company, helping all kinds of writers with every part of the writing process. Currently pursuing a BA in English with a specialization in writing, I have taken multiple courses in creative writing, creative nonfiction, and advanced nonfiction.",Nicole Hicks,2017-02-24,18.0,"January 17, 2014",0,https://www.upwork.com/freelancers/_~0171bb2e4661fbc709,4,4.9352977019
218,https://odesk-prod-portraits.s3.amazonaws.com/Users:vbartlemus1:PortraitUrl_50?AWSAccessKeyId=1XVAX3FNQZAFC9GJCFR2&Expires=2147483647&Signature=MmhwKfeZkp%2F%2Fiemod52ZaQaIrTk%3D&1438410129643261,Writing,Independent,Writer and Editor,editing--english-punctuation--microsoft-word--online-writing--english--english-grammar--journalism-writing--content-writing,United States,"I am an experienced writer and editor. I have over five years of online writing experience, and my work has been published on sites such as Yahoo! News, Yahoo! Shine, and eHow, as well as on numerous blogs. I was a Featured Lifestyle Contributor and had a parenting beat on the Yahoo! Contributor Network until the program's termination in 2013. I specialize in articles in the parenting and green living niches, but have completed jobs on a broad spectrum of topics. My editing experience is predominantly in the fiction writing and academic writing fields, and my clients most often compliment my thoroughness, unique sense for good flow and readability, and attention to detail. I have a B.A. in Journalism and Psychology and an M.S.Ed.. in Childhood Special Education.",Vanessa Bartlemus,2017-02-24,30.0,"April 1, 2013",3,https://www.upwork.com/freelancers/_~01c844d1f2f31f30c9,0,4.9788430598
219,https://odesk-prod-portraits.s3.amazonaws.com/Users:dmichelebryan:PortraitUrl_50?AWSAccessKeyId=1XVAX3FNQZAFC9GJCFR2&Expires=2147483647&Signature=A4eeVWCWsUdKn1H%2F%2FtlX%2BUvjYzg%3D&1461159476008118,Design & Creative--Writing--Sales & Marketing--Customer Service,Independent,"Actress, Writer, Videographer, Marketing Aficionado",creative-and-talent--voice-talent--voice-over--photography--social-media-management--videography--creative-writing--social-media-marketing--video-editing--project-management,United States,"Storytelling and writing have always been an integral part of who I am, and it has shaped my working experience throughout my life.I am an excellent communicator who is able to covey stories in both the written and spoken word, and I currently hold a B.A in Theatre and a B.S in Telecommunications News from the University of Florida. I honed my marketing experience as an intern at the Hippodrome State Theatre (an Equity Regional Theatre) where I helped manage their social media (Facebook, Instagram, Twitter). I furthered their marketing agenda by creating video content for Facebook and Instagram. I am a published author in two books for short stories, poems, and essays, and recently had a short play produced and performed onstage at the Hippodrome State Theatre. I am also an Actor's Equity Candidate. Having a wide range of skills, I would be an asset to anyone who seeks a dedicated employee with an appetite for creative and effective content. ",Drew Bryan,2017-02-09,17.0,"April 15, 2016",0,https://www.upwork.com/freelancers/_~01db98656fe3d88496,2,5.0
221,https://odesk-prod-portraits.s3.amazonaws.com/Users:mpsvirtual:PortraitUrl_50?AWSAccessKeyId=1XVAX3FNQZAFC9GJCFR2&Expires=2147483647&Signature=wwzozCvOm12uu91msLUYsOAVeKw%3D,Writing,Independent,Writer/Transcriptionist,transcription--writing,United States,"I have been a freelancer since October 2012. I have done various freelancing tasks including transcription, blogging, content editing, and ghost writing. I'm a full time freelancer with office hours from 8am to 5:30pm CST Monday - Friday and weekends as needed.I have a tested typing speed of 98 wpm which makes me extremely efficient.Native English speaker.I use NCH ExpressScribe for all my transcription work.",Paul Shirey,2017-02-10,22.22,"February 25, 2015",0,https://www.upwork.com/freelancers/_~0171e53c8220be6186,2,4.9298054383
222,https://odesk-prod-portraits.s3.amazonaws.com/Users:nanebreha:PortraitUrl_50?AWSAccessKeyId=1XVAX3FNQZAFC9GJCFR2&Expires=2147483647&Signature=nLxnPwOcnSILKhK9AfbfBN7VCXg%3D,Translation--Design & Creative--Writing,Independent,Journalist and Designer,article-writing--blog-writing--adobe-photoshop--adobe-indesign--adobe-illustrator--creative-writing--photography--photo-editing,Romania,"Sometimes, in the nights, I cant wait for morning to come so I can start writing. This is me! Passionate about writing, with excellent skills in the area, I would describe myself as a creative and responsible person. Somy name is Ioana Breha, I am 23 years old and I have a degree in Journalism.My passions are to take photographs and then to edit them. Also, I like graphic design. I would not see myself doing something else in my life, except writing, photographs and design! Also, I love foreign languages and I know Romanian, Italian, English and a bit of Spanish.",Ioana Breha,2017-02-24,11.11,"October 16, 2013",0,https://www.upwork.com/freelancers/_~01abc5d6831ef2c70d,0,4.9459722786
223,https://odesk-prod-portraits.s3.amazonaws.com/Users:lisa_linnea:PortraitUrl_50?AWSAccessKeyId=1XVAX3FNQZAFC9GJCFR2&Expires=2147483647&Signature=3fPybckBeQ%2BSeJEeoi1FIAkN92w%3D&1463430721468794,Writing--Translation,Independent,Article Writing - Translation - Admin Support,wordpress--adobe-photoshop--article-writing--google-adwords--translation-swedish-english--translation-english-swedish--content-writing--web-content-management--seo-writing--ebay-listing-writing,Sweden,"I am an ambitious and creative consultant, e-commerce entrepreneur and content writer.My native language is Swedish and I am fluent in English. As a consultant (in the business of project evaluations and surveys) I am very experienced in writing, handling and translating documents in Swedish, Danish, Norwegian and English. I also run a web shop which I built in Wordpress / Woo-commerce.I am used to search for information on the web, compiling spreadsheets, data entry and other administrative tasks. I am trustworthy, structured and I always do my work carefully and in time!Summary of what I can help you with:*TranslationSwedish -> EnglishEnglish -> SwedishNorwegian -> SwedishDanish -> Swedish*Writing SEO website content and articles*Google AdWords*Photoshop, eg. editing pictures, photos, creating logotypes etc.*Help on any kind of survey and application*Data entry*Compiling spreadsheets",Lisa Rosen,2017-02-24,15.0,"July 3, 2009",10,https://www.upwork.com/freelancers/_~01b3a9af3f9320bc57,0,4.8547232381
224,https://odesk-prod-portraits.s3.amazonaws.com/Users:xtoph:PortraitUrl_50?AWSAccessKeyId=1XVAX3FNQZAFC9GJCFR2&Expires=2147483647&Signature=NrNKKgEbPEMA3WVzL3vtgVl7HOg%3D&1451406911904200,Writing,Independent,Professional Writer,writing--reviews--seo-writing--creative-writing--product-descriptions--copywriting--short-story-writing--business-writing--website-development--wordpress,Canada,"I think every article has room for a touch of creativity and character, no matter how dry the subject matter. When readers connect with content they turn into customers pretty much every time.My range of topics is very broad, and I can adjust my tone to suit almost any niche or market. I wouldn't bid on a job if I wasn't sure I could exceed expectations.",Christoph Sushnyk,2017-02-24,15.0,"August 19, 2011",6,https://www.upwork.com/freelancers/_~010d82a324b1dd63e0,1,4.7993894623
225,https://odesk-prod-portraits.s3.amazonaws.com/Users:nicoleboyce:PortraitUrl_50?AWSAccessKeyId=1XVAX3FNQZAFC9GJCFR2&Expires=2147483647&Signature=J5Zg4YRN5WQsleslVUHaGOntFX4%3D&1464762586352015,Writing,Independent,Writer and trauma counsellor,article-writing--academic-writing--seo-writing--counseling-psychology--psychometric-examinination,South Africa,"I have a passion for writing and psychology, and I enjoy research. I have have studied Psychology, English, Commerce, and Anthropology at University. I hold a postgraduate degree in Counselling Psychology. I am also trained as a trauma counsellor. In addition, I have experience writing both academic and SEO articles.  ",Nicole Boyce,2017-02-24,15.0,"February 17, 2015",0,https://www.upwork.com/freelancers/_~01c21667c80ba836f0,2,5.0
226,https://odesk-prod-portraits.s3.amazonaws.com/Users:exspinential:PortraitUrl_50?AWSAccessKeyId=1XVAX3FNQZAFC9GJCFR2&Expires=2147483647&Signature=tBkV6u6etkMvlq9%2FBEJqRTEJxI0%3D&1435926926920667,Writing,Independent,"Experienced Copy Writer, Blogger, and Editor",english--newsletter-writing--proofreading--synopsis-writing--theology--tourism--travel-writing--ebooks--online-writing--article-rewriting,United States,"I'm a native English speaker living in and traveling around America. I have extensive experience as a blogger, article writer, content writer, and editor. My areas of expertise include homeschooling, US travel, limited world travel, horses and other animals, child-rearing, education, ministry, literature, home management, homestyle cooking, Crohn's disease, restrictive diets, and more. My research skills are exceptional, so almost no area is off limits. I am honest and hardworking, and only take on as many projects as I can reasonably handle. That means your project will be my main focus...unless, of course, the zombie apocalypse occurs, in which case I'll be running and screaming with the rest of you. ",Christy Bagasao,2017-02-24,27.0,"February 14, 2011",1,https://www.upwork.com/freelancers/_~0184d99df6344169e1,0,5.0
