,portrait_50,categories2,profile_type,title,skills,country,description,name,last_activity,rate,member_since,portfolio_items_count,id,test_passed_count,feedback
675,https://odesk-prod-portraits.s3.amazonaws.com/Users:consuelosperanza:PortraitUrl_50?AWSAccessKeyId=1XVAX3FNQZAFC9GJCFR2&Expires=2147483647&Signature=LBQoUzNwbkVlIRNIbc3bt1aisRI%3D,Translation--Writing,Independent,"Forex Translator, Forex copywriter, Italian Forex translator",translation-english-italian--forex-trading--blog-writing--creative-writing--article-writing,Italy,"I am an Italian translator/writer specialized in financial market analysis,trading, binary options and forex. Over the past few years, I have had the opportunity to work with different Forex Analysis websites gaining some excellent experience in financial/forex contents translation and copywriting. I work as an EN>IT EN<>RU in-house translator for many leading Forex brokers and sites. Having gained a strong financial and forex expertise over the last seven years, I am now able to meet very tight deadlines - most documents are to be returned within the next hour and I have often to deal with extremely large volumes - 10000 words per day. I translate at a rate of 1000 words/hour using a hq dictation software and no CAT tools.I have a master's degree in translation and can work from English, Russian and Spanish into Italian, both English into Russian and Russian into English and English into Spanish.I'm open to job offers in my fields of expertise. With the help of some colleagues I can also provide Forex translation into French, Arabic, Chinese and Romanian.Feel free to contact me.Service DescriptionArticles on forex technical analysis for all currency, gold, silver and crude oil (English/Italian).Manual of technical analysis / forex markets (Italian).English / Italian - Italian / English forex translations.",Consuelo Speranza,2017-02-24,17.78,"January 7, 2012",0,https://www.upwork.com/freelancers/_~01f29539d59c8f4a51,3,5.0
676,https://odesk-prod-portraits.s3.amazonaws.com/Users:c_jiao_wei:PortraitUrl_50?AWSAccessKeyId=1XVAX3FNQZAFC9GJCFR2&Expires=2147483647&Signature=u6eeMjTBur7TvJhkCL%2B3rFGwnyk%3D&1447526898750684,Translation--Writing--Admin Support,Independent,English to Chinese Translator ,translation-english-chinese--translation-chinese-english--translation-english-malay--translation-malay-english--data-entry,Malaysia,"I am a Malaysian Chinese. Chinese is my mother tongue. I had my studies learning in Chinese since kindergarten until high school, which covers about 10 years of proper education in Chinese language. English is my second language, which I have started to in touch since kindergarten as well but it did not gets along with me well until my high school, the time I first study science and mathematics in English. I started to write blogs in Chinese and English before I graduate from high school. I treat it as a good way to revise and maintain my Chinese language and a good practice to improve my English. I graduated from University of Science, Malaysia in August 2014 as a Food Technology student from School of Industrial Technology. I have took management course as my minor subjects. During my undergraduate life, I actively participate in the Chinese society as an event committee, to work with people from different background and major, to learn how to to organize an event, how marketing works to promote an event and of course, the most important is to contribute to my Chinese language and to make more friends. During my second year I have participated a Malaysia-Indonesia-Thailand government project for a student exchange program in Mae Fah Luang University, Thailand. I have been staying there for a semester, to study and for culture exchange. I have also learn some basics of Thai language in daily conversation.Soon after graduate, I join in Kerry Ingredients and Food, an Ireland-based company for their graduate management program in Asia Pacific region. Working in the business group service center, I have been expose to the different cultures and also cross functional training. At Upwork, I am a fresh freelancer here get ready to gain experience in translation world, with the objective to keep both my languages trained and sharpen when time gets along.",Chong Jiao Wei,2017-02-18,10.0,"May 2, 2015",1,https://www.upwork.com/freelancers/_~015de89d9b20d1fac7,1,4.9636363636
684,https://odesk-prod-portraits.s3.amazonaws.com/Users:dinrathsl:PortraitUrl_50?AWSAccessKeyId=1XVAX3FNQZAFC9GJCFR2&Expires=2147483647&Signature=BQ0Bl4IFFMwhHtG%2F4EgaOdGcfWg%3D&1481609747494725,Translation--Writing--Design & Creative,Independent,Freelance translating service (EN/FR),translation-english-french--translation-french-english--translation--french--editing--proofreading--content-writing--article-writing--research--wpml,Egypt,"Premium quality, professional translations, reliable and always on time! Skilled and trained English/French translator, proofreader and editor. 5 years experience, two master degrees in Science and Biology. Translation of websites, books, presentations, articles, blogs, guides, brochures & other documents in various areas of expertise:- Science incl. marine biology, medical, environment, health, nutrition & research- Marketing incl. tourism, travel, leisure & sports (scuba-diving)- Trade & branding incl. entrepreneurship, marketing, legal, product description- Books & eBooks incl. non-fiction, fiction, self-development & entrepreneurshipPlus: HTML, Wordpress, photography, content-writing, SEO, web development, Spanish and more.",Laura D.,2017-02-21,25.0,"December 29, 2013",16,https://www.upwork.com/freelancers/_~01f0a112a7e7382527,8,4.9988663417
687,https://odesk-prod-portraits.s3.amazonaws.com/Users:masterphoenix:PortraitUrl_50?AWSAccessKeyId=1XVAX3FNQZAFC9GJCFR2&Expires=2147483647&Signature=ZZZNcg40zW50EAqmnN8shbxfS88%3D,Translation--Writing--Sales & Marketing,Independent,Writer and Translator,article-writing--translation-english-spanish--academic-writing--blog-writing--content-writing--creative-writing--english-tutoring--image-editing,Mexico,"I am a writer, translator and editor who is not only qualified to perform the tasks required, but is also open to learning new things every day.I have journalism experience as well as creative writing in both Spanish and English.My work is done with time in mind, which means I can work fast without the overall quality suffering.I can write in a serious and professional tone when it is required, but I am also capable of switching to a more relaxed tone, if need be.",Armando Garca,2017-02-07,11.11,"November 8, 2014",1,https://www.upwork.com/freelancers/_~0133b251d861e0bb4e,8,4.9359532031
690,https://odesk-prod-portraits.s3.amazonaws.com/Users:readham:PortraitUrl_50?AWSAccessKeyId=1XVAX3FNQZAFC9GJCFR2&Expires=2147483647&Signature=wPIwyPajmr9Mm%2Fi21NKrWujjs%2FI%3D&1474978933487761,Writing,Independent,"Creative writer and thinker, blogger, copywriter and proofreader",creative-writing--blog-writing--copywriting--article-writing--article-rewriting--editing--english-proofreading,United Kingdom,"I am native English-speaking, with a business degree from London South Bank University.I have worked for nearly twenty years across a number of industries where I have spent a long time honing and crafting my writing skills to ensure they give a lasting impression to the reader, whoever that may be.My main experiences come from being a senior manager in an online marketing agency, working with big spending clients and perfecting their marketing message across multiple platforms.I have most recently owned and run my own renewable energy business in which I was primarily charged with all aspects of the companys marketing portfolio.I am now concentrating on freelance writing and blogging.My work is guaranteed to be creative and on time and I have twenty years experience as a senior client/customer manager which ensures that I know how to follow your specific brief exactly to your requirements.I look forward to working with you.",Andrew Dedman,2017-02-13,13.0,"July 5, 2016",0,https://www.upwork.com/freelancers/_~012304fb641eba5f22,1,4.9833217512
691,https://odesk-prod-portraits.s3.amazonaws.com/Users:silvia2014:PortraitUrl_50?AWSAccessKeyId=1XVAX3FNQZAFC9GJCFR2&Expires=2147483647&Signature=CteDDj8jN6VqGRZgocvQD1CyeV0%3D&1485697399663261,Writing--Translation,Independent,"Writer, Researcher, Language Expert, Translator",english--ebooks--academic-writing--article-writing--editing--proofreading--creative-writing--research--translation-english-romanian--translation-romanian-english,Germany,"B.A. in English, M.A. in American Cultural Studies, currently a PhD Candidate in North American Literature and Culture (Humboldt University of Berlin)Languages are my vocation and I'm extremely keen on reading and writing. I have 10+ years of experience in writing, translation, and editing. I've worked mostly with books, articles, documents, and promotional material. I've translated 8 books for renowned publishing houses. As a freelance writer, I have already written over 100 ebooks on various subjects. I also have 7+ years of teaching experience in English in public&private education (academia included). My preferred fields as a writer, translator, and editor: - Social sciences- Languages&literature- Art&culture- Health&nutrition- Fashion&beauty- Dating&relationships- Personal development- Self-help - Media&communication- Tourism - Spirituality&world cultures- History/Biography I'm available for: * E-books * Research* Academic/scientific writing * Content writing * Reviews * Articles * Creative writing * Reports * Promotional writing/marketing* Language services - translation (working languages: English, German, Romanian) - editing, proofreading Broadly speaking, I can do many things that require consistent research skills and innate talent for turning language into material that you can control and adapt to your goals ....while it keeps fascinating you. Words are a powerful tool. They have to be maneuvered in high awareness of their potential to convince and transform. I can skillfully merge thorough and precise research with ingenious vision and style. I'm the best choice if you're looking for an informative, insightful, witty, and vivid kind of writing. In my work I'm flexible, but I always aim at high quality. Contact me!",Silvia C.,2017-02-24,27.78,"March 22, 2014",24,https://www.upwork.com/freelancers/_~011a6f36cdc952bab0,10,4.844931127
699,https://odesk-prod-portraits.s3.amazonaws.com/Users:chowdhurynita:PortraitUrl_50?AWSAccessKeyId=1XVAX3FNQZAFC9GJCFR2&Expires=2147483647&Signature=KB31bLeUzeKJDQ5N2mXD2eXXM1k%3D&1477026881028410,Design & Creative--Writing,Independent,"Agency Creative Head with proven visualizing, design and copy skills",copywriting--corporate-brand-identity--graphic-design--logo-design--poster-design--banner-design--adobe-after-effects--adobe-premiere--creative-writing--animation,India,"With over 20 years of professional experience as the Creative Head of my agency, SKYWRITE, I have worked conscientiously with my dedicated team members for a varied client-mix and gained adequate experience to responsibly conceptualize, plan, develop, design and execute campaigns for press, print, audio-visual and outdoor media. Creativity is my forte & deadlines sacrosanct. Marketing your business, I understand is critical. To stand tall, your communication and design elements need to be unique, also in  sync which will help you generate maximum mileage over competition. I can help you build a brand with innovative ideas and designs. With engaging scripts and lyrics, I can fulfill your video and audio requirements as well. Whether you want to build a brand from scratch or improvise on an existing job, I am flexible & you can hire me for your work. I shall give my 100% to satisfy your requirement.Theme development,  Caption writing, Company Naming, Logo design,  Brochure,  Mailer,  Poster,  Dangler,  Leaflet,  Flyer,  Banner,   Hoarding,  Packaging design,  Stationery design,  Annual report,  Flash banner,  2D & 3D Animation,   Presentation,  Jingles,  TVC,  Corporate and Product videos",Nita Chowdhury,2017-02-22,25.0,"May 4, 2016",19,https://www.upwork.com/freelancers/_~01f1753a51df98469c,0,4.2
715,https://odesk-prod-portraits.s3.amazonaws.com/Users:shamuji:PortraitUrl_50?AWSAccessKeyId=1XVAX3FNQZAFC9GJCFR2&Expires=2147483647&Signature=NuZCqx3ZxpIUQvmK31VaMgdmNiQ%3D,"Writing--IT & Networking--Web, Mobile & Software Dev--Admin Support",Independent,Content writer and Developer,c--c++--sql--microsoft-powerpoint,Pakistan,I want to sell the skills that I acquire and most important thing filling the social gaps through IT world and recognizing the existance of each individual.,Ehtisham Ullah,2017-02-21,10.0,"July 13, 2014",2,https://www.upwork.com/freelancers/_~013320c8b31ad37246,4,5.0
716,https://odesk-prod-portraits.s3.amazonaws.com/Users:dhs1024:PortraitUrl_50?AWSAccessKeyId=1XVAX3FNQZAFC9GJCFR2&Expires=2147483647&Signature=uGGVKroAFy0CVkR%2FjCg6Dfywj0M%3D&1461102334904542,Translation--Writing,Independent,"Korean Translator, Associate Editor for K-Pop Website",blog-writing--translation-korean-english--translation-english-korean--adobe-photoshop,United States,"Korean translator for both english to korean and korean to english translations. Especially good at translating kpop/culture related articles. Good with blogging on topics such as fashion, styling, beauty, cosmetics, etc.",Diana S.,2017-02-20,26.0,"April 20, 2012",0,https://www.upwork.com/freelancers/_~01373e483b47103cc1,1,4.9656042192
717,https://odesk-prod-portraits.s3.amazonaws.com/Users:jennysem:PortraitUrl_50?AWSAccessKeyId=1XVAX3FNQZAFC9GJCFR2&Expires=2147483647&Signature=H6RRerjZGlVxghYh9EWlMJ9xqec%3D,Customer Service--Admin Support--Writing--Accounting & Consulting--Sales & Marketing,Independent,Customer Support and Communication Specialist,creative-writing--ebay-listing-writing--ebook-writing--english-proofreading--resume-writing--virtual-assistant--document-review--reviews--chat-support--live-chat-operator,Canada,My career has been spent in all levels of customer support.  I have worked as part of a team on help desks for large corporations where I troubleshoot problems with both internal and external clients.  I am a very quick learner and willing to give anything a try.  ,Jenn S.,2017-02-07,20.0,"March 11, 2013",0,https://www.upwork.com/freelancers/_~01d203a0eb5a2ea726,8,5.0
719,https://odesk-prod-portraits.s3.amazonaws.com/Users:stchambers:PortraitUrl_50?AWSAccessKeyId=1XVAX3FNQZAFC9GJCFR2&Expires=2147483647&Signature=8lvxyNgcSxiidqjiyaYjZii1wE8%3D&1452463616625632,Writing,Independent,"Quality, living SEO content.  ",content-writing--creative-writing--ghostwriting--seo-writing--english--google-analytics,United Kingdom,"Quality, living content, SEO primed. Seamlessly embedded organic keywords. Long click copy. Comprehensive research. Experienced creative writer. HTML titles.. description tags.. headlines. Link and authority building. Social media savvy.      ",Steven C.,2017-02-18,16.5,"August 7, 2013",4,https://www.upwork.com/freelancers/_~01f9438313779bdd48,2,4.9820294717
721,https://odesk-prod-portraits.s3.amazonaws.com/Users:pete_vidins:PortraitUrl_50?AWSAccessKeyId=1XVAX3FNQZAFC9GJCFR2&Expires=2147483647&Signature=E%2BVehqyBpEDBWye9Oye1xDmfQaw%3D&1443403565412446,Writing,Independent,Master Black Belt in Content. ,wordpress--content-writing--creative-writing--english--blog-writing--feature-writing--writing--speech-writing--online-writing--english-spelling,Australia,Freelace writer. Dad. Dangerously handsome. Itching to write for you. ,Pete Vidins,2017-02-24,15.0,"July 16, 2014",0,https://www.upwork.com/freelancers/_~0126fb799c2c3f91bd,0,4.9512048193
722,https://odesk-prod-portraits.s3.amazonaws.com/Users:estherrosenow:PortraitUrl_50?AWSAccessKeyId=1XVAX3FNQZAFC9GJCFR2&Expires=2147483647&Signature=hQxzDU6UyQi7yea3cT7K6B8e7mo%3D&1444158120195713,Writing,Independent,Proofreader dedicated to beautiful language,editing--english-spelling--english--copy-editing--english-grammar--english-proofreading--english-punctuation--creative-writing,United States,"I am a proofreader dedicated to helping you craft beautiful, effective language.",Esther R.,2017-02-24,20.0,"September 18, 2010",0,https://www.upwork.com/freelancers/_~018bdb0774d579d01b,0,5.0
728,-,Customer Service--Writing--Admin Support,Independent,"Quick & Correct, Always!",internet-research,United States,Provide first rate services via online mediums to employers worldwide.Data servicesOnline ResearchOnline seller services,Patrick S.,2017-02-11,16.0,"December 5, 2011",0,https://www.upwork.com/freelancers/_~01507357a6ec8c18c6,3,4.8406817458
735,https://odesk-prod-portraits.s3.amazonaws.com/Users:tsoroker9:PortraitUrl_50?AWSAccessKeyId=1XVAX3FNQZAFC9GJCFR2&Expires=2147483647&Signature=AcwleRBTrwB6XgcRWtSN76VC8d4%3D&1482187541070156,Writing,Independent,Web Researcher and Content Producer,wordpress--internet-research--mathematics--financial-writing--financial-analysis,United States,"I am a recent graduate of Northeastern University where I studied theoretical mathematics, journalism and Judaic studies. At the end of my third year of school, I interned full-time for a financial tech start-up in Tel Aviv. There, I produced articles based on mathematical theory and financial concepts which were then published to the company website. Throughout the six months that I worked for I Know First, I learned about SEO optimization and WordPress navigation while I honed my writing skills. Aside from I Know Firsts website, my writing was also published to sites such as Forbes Magazine and NG Data.I am passionate about gaining new understandings in my field and others and I hope to reflect that in my writing. My schedule is flexible which allows me to be available to discuss your project and offer fast turnaround. To see a collection of my writing, please go to my blog and website talisoroker.wordpress.com.",Tali Soroker,2017-02-24,15.0,"December 19, 2016",0,https://www.upwork.com/freelancers/_~017c57d69c74488680,1,0.0
736,https://odesk-prod-portraits.s3.amazonaws.com/Users:rachelj1021:PortraitUrl_50?AWSAccessKeyId=1XVAX3FNQZAFC9GJCFR2&Expires=2147483647&Signature=SNcFiUSRIWbNIjMg%2Fwd%2FPPEFKw0%3D&1437426083773337,Writing,Independent,Writer and Editor,wordpress--microsoft-office--html--content-writing--blog-writing--editing--article-writing--creative-writing--seo-writing--press-release-writing,United States,"I'm a professional content writer with experience working with in-house marketing departments at startups and within the educational sector. I focus on targeting your specific client audience while generating quality content in timely fashion. I believe in an adaptable style which can be tailored upon request to speak to the specific audience. Quality is my number one priority. See my portfolio for examples of website copy, press releases, blog posts, and more. I am experienced in content production for web pages, infographics, and marketing scripts. I am proficient with WordPress and have a basic understanding of HTML. I have developed SEO compliant content and am experienced with editing and topic research.",Rachel Johnson,2017-02-24,11.11,"July 15, 2015",1,https://www.upwork.com/freelancers/_~01defd6beb4c3b1504,1,0.0
749,https://odesk-prod-portraits.s3.amazonaws.com/Users:ramezk:PortraitUrl_50?AWSAccessKeyId=1XVAX3FNQZAFC9GJCFR2&Expires=2147483647&Signature=35fIeuoMt%2BBmpjXPwB4%2B4zro6gc%3D&1434120126013532,Writing--Admin Support,Independent,Medical Student,data-entry--blog-writing--email-handling--reviews--bookkeeping--management-skills--human-sciences--medical-writing--scientific-research--presentations,Lebanon,"Attentive, efficient, and professional university graduate,  with 5 years experience in data handling and research. Extensive science background and tech savvy that is always up to date with technological advancements and social media. Blog and entry writer on scientific and technology topics.",Ramez K.,2017-02-23,15.0,"June 12, 2015",0,https://www.upwork.com/freelancers/_~014b5c7c3ec6991c0d,0,0.0
750,https://odesk-prod-portraits.s3.amazonaws.com/Users:parsons_michael:PortraitUrl_50?AWSAccessKeyId=1XVAX3FNQZAFC9GJCFR2&Expires=2147483647&Signature=6zLZQWFSubowNgRhgH1yQM0FnRE%3D&1480366092084085,Writing,Independent,Experienced writer and content strategist,adobe-creative-suite--microsoft-connect--vcita,United States,"I am an experienced freelance journalist, blogger, and editor. I also work as a content strategist and digital media strategist for a couple of humanities based not-for-profit organizations. In addition to experience as a freelance journalist and editor, I am also an experienced researcher.",Michael Parsons,2017-02-04,30.0,"November 28, 2016",0,https://www.upwork.com/freelancers/_~01977b5da749b99726,0,0.0
770,-,Customer Service--Sales & Marketing--Writing--Admin Support--Accounting & Consulting,Independent,Customer service and admin whizz.,english--resume-writing--advertising--sales--computer-skills--customer-service--general-office-skills--phone-support--time-management,New Zealand,"Background in administration, data entry, client service, HR and marketing. Strong research skills and very customer service orientated. Confident with technology. Full access to a home office. Friendly, smart, prompt. ",Mel R.,2017-02-24,20.0,"September 14, 2012",0,https://www.upwork.com/freelancers/_~011f6215f90aff28a0,1,4.9302481719
