,portrait_50,categories2,profile_type,title,skills,country,description,name,last_activity,rate,member_since,portfolio_items_count,id,test_passed_count,feedback,filename,alreadyMessaged
79,https://odesk-prod-portraits.s3.amazonaws.com/Users:travishume:PortraitUrl_50?AWSAccessKeyId=1XVAX3FNQZAFC9GJCFR2&Expires=2147483647&Signature=ai%2B3lgH5ZNU%2F7rSvmjuY8ejxZGw%3D&1487766736846854,Writing,Independent,Applied Virtue-Ethics Blog and Article Writer,microsoft-office--creative-writing--wordpress--customer-service--article-writing--blog-writing,United States,"I have been writing consistently for the last five years, implementing the material through my pursuits. Currently, I serve as a Special Education Instructional Assistant. My professional background is in Higher Education Residence Life, and assisting special needs and emotional support populations. My content has remained focused on the real-world modern-day application of ancient virtue-ethics philosophy. In the initial two years of this endeavor, my writing was kept largely to myself. I regularly scrutinized the material for accuracy, form, flow, and consistency. I could help no-one through my writing, I thought, if I were writing for show, did not research the subject and context properly, or failed to apply it myself.Once I was certain that my intentions in writing were appropriate, applicable to everyday life, and respected the subject matter, I began posting new material through a public group I created on the social media platform Facebook, ""Applying Stoicism."" The initial influx of members consisted of friends, coworkers, and family that were familiar with my work. I did very little advertising for the group until approximately a year into its life. Through word of mouth, the group expanded at a rate of 2-3 members per day from its relatively stable original population of 50. The rate of member applications increased to an average of 4-5 members per day following advertising in similarly-themed social media groups. The current member population stands at over 1,800 members and continues to expand daily.I have published two articles on applied virtue-ethics philosophy for modernstoicism.com - a site managed by therapists, professors, and authors that explores evidence-based approaches in benefiting from applied philosophy. In addition, I post freely-available weekly content of annotated pieces of my early writings on my website applyingstoicism.com, linked to Google+, Twitter, Patreon, and Facebook counterparts. As of this writing, 15 annotated pieces have been released. Other material includes compilations of a 14-week written workshop on applying virtue-ethics philosophy on a variety of subjects, and 68 pages of personally-written content posts from the beginning of the previously mentioned Facebook group, ordered by date.I am here to offer my writing skills to you, so that I might test and refine them, while improving the quality of life for you, your organization, and those it affects. I am unafraid of new or controversial subjects, constructive critique, or being held accountable. I pride myself on self-discipline, resilience, and following-through. I would be happy to discuss further how I will prove to be an asset to your company.",Travis Hume,2017-02-26,13.0,"February 21, 2017",4,https://www.upwork.com/freelancers/_~0129c977d0f5408d47,4,0.0,upworkResourceCSV_10k_0.csv,
5296,https://odesk-prod-portraits.s3.amazonaws.com/Users:kweaver1974:PortraitUrl_50?AWSAccessKeyId=1XVAX3FNQZAFC9GJCFR2&Expires=2147483647&Signature=7xdVJKw%2B8DqbD21T9MMWT6g4amQ%3D,Writing,Independent,Owner - Karl Weaver Freelance Writing,creative-writing--microsoft-word--microsoft-excel--english,United States,"I am primarily a writer of short fiction, with a number of fantasy stories in publication.  One of my stories graces the landing page of anytime_shorts.com.  While story telling is my forte, I have experience at business profiling, article writing, and developing web content.",Karl Weaver,2017-03-02,13.33,"December 7, 2013",1,https://www.upwork.com/freelancers/_~013cfbe700bc12fdce,5,4.9196428571,upworkResourceCSV_10k_16.csv,
10602,https://odesk-prod-portraits.s3.amazonaws.com/Users:ranchcookie:PortraitUrl_50?AWSAccessKeyId=1XVAX3FNQZAFC9GJCFR2&Expires=2147483647&Signature=9O0zi0tAdjphD3MK5Me%2FzYmM0Ws%3D&1455970426769119,Writing,Independent,"Food Photographer, PPC Manager, Blogger, Wordpress Creator",wordpress--wordpress-plugin--seo--blog-writing--blog-commenting--blog-development--physical-fitness--photo-editing--photography--ppc-advertising,United States,"My name is Hilary and I am a recipe developer, photographer and lifestyle blogger. I have photos accepted in foodgawker, finding vegan and healthy aperture. As my full time job I work in paid search advertising with google search network and bing advertising network.",Hilary Jones,2017-02-19,21.0,"February 20, 2016",,https://www.upwork.com/freelancers/_~01f2bf264afa4180a5,3,5.0,upworkResourceCSV_10k_18.csv,
14213,https://odesk-prod-portraits.s3.amazonaws.com/Users:aldstan:PortraitUrl_50?AWSAccessKeyId=1XVAX3FNQZAFC9GJCFR2&Expires=2147483647&Signature=6eToxka8gK40Zv6OFgpvn8mPDjo%3D&1487906983266179,Writing,Independent,Proofreader and Copy Editor,microsoft-connect,United States,"I am an English word nerd, familiar and proficient with all periods of the language from 1100 AD onward.  I have been a creative writer for about twenty-two years for my own personal enjoyment.  I have proofread and edited essays and small books for friends, and now I would like to try my hand at this professionally.  Other areas of interest and/or expertise include: European and U.S. history, politics, theology, ethics, culture, travel, nutrition and natural medicine, and survival and outdoor skills.",Michael Trudeau,2017-02-24,20.0,"February 24, 2017",,https://www.upwork.com/freelancers/_~01726eb4deaee6876d,,0.0,upworkResourceCSV_10k_20.csv,
943,https://odesk-prod-portraits.s3.amazonaws.com/Users:lalic-sanja:PortraitUrl_50?AWSAccessKeyId=1XVAX3FNQZAFC9GJCFR2&Expires=2147483647&Signature=L%2ByRU%2B4azuw5OUQ%2FUGAdVXpGcdM%3D&1461764289177010,Writing,Independent,Content Writer,writing--article-writing--product-descriptions--blog-writing--online-writing--seo-writing--copywriting--sales-writing--newsletter-writing--news-writing-style,Serbia,"!!! RATE: $0.03 PER WORD !!! A word after a word after a word is power                                            Margaret Atwood If you're looking for 100% ORIGINAL and WELL-RESEARCHED articles, blog posts, or product descriptions, don't hesitate to contact me! I'm comfortable writing on a wide variety of topics - everything from fashion to technology. I have a Master's degree in English language and literature, a wealth of writing experience and a genuine passion for the written word. I have a proven track record of MEETING TIGHT DEADLINES, a keen eye for detail, a flexible attitude, and a strong sense of personal and professional responsibility. Looking forward to hearing from you!",Sanja L.,2017-02-15,12.5,"October 22, 2015",3,https://www.upwork.com/freelancers/_~0123fd8fdb3980da53,5,5.0,upworkResourceCSV_10k_0.csv,
11401,https://odesk-prod-portraits.s3.amazonaws.com/Users:lukesmith_95:PortraitUrl_50?AWSAccessKeyId=1XVAX3FNQZAFC9GJCFR2&Expires=2147483647&Signature=KZnSp%2BKthKiIHcjf5UFx6AG18uk%3D&1487693010791188,Writing,Independent,Freelance researcher/writer,essay-writing--editing--proofreading--history--research--article-writing,United Kingdom,"I am currently at university studying History (BA Hons) in Liverpool, UK. I am continuing my studies at a Masters level (MRes in Modern History) from September 2017. I always score highly on my academic writings, and have experience in writing articles as well as academic essays.I have excellent research and writing skills of which I hope to use to give me further experience.Also, I have great interest in sport and music. I am willing to write/research/proofread etc on many subjects.",Luke Smith,2017-02-21,10.0,"January 4, 2017",,https://www.upwork.com/freelancers/_~01c24d0c8e8fb445ee,,0.0,upworkResourceCSV_10k_19.csv,
9978,https://odesk-prod-portraits.s3.amazonaws.com/Users:dwivediprashan31:PortraitUrl_50?AWSAccessKeyId=1XVAX3FNQZAFC9GJCFR2&Expires=2147483647&Signature=hgjV97x3KUInqFT3s9e4tzEreF8%3D,"Sales & Marketing--Web, Mobile & Software Dev--Admin Support--Design & Creative--Writing",Independent,PhoneGap | WordPress | Larval | codeigniter|Python|ColdFussion|SEO,php--jquery--json--javascript--ajax--wordpress--magento--cakephp--html5--css,India,"I have more than 6 years of experience in web development as a programmer as well as a Team Leader. I have been doing web/graphic design and development for different type of application including e-commerce, CMS, portals, CRM etc.I am well skilled in HTML, CSS, JAVASCRIPT, JQUERY, PROTOTYPE, PHP, MYSQL, API'sTechnologies I am Expert in:1. SEO2.Web Designing: Photoshop,Illustrator,Graphic design,flyers,landing pages 3.Web Development:  >Wordpress, Woo-commerce expert: > Shopify: > Big-Commerce: > Magento: > Drupal:  > Joomla:  > Prestashop > Python,ColdFusion ,MangoDb,Concrete, Kohana, > Squarespace >Opencart >YII,Codeigniter,Laravel,Cakep Php > Android,Ios Application,PhoneGap >Node .js ,angular ,jsSome Other Useful Skills:I have good knowledge of API's, Scraping, Payment Method implementation like http://Authorize.net, Paypal, Stripe, Recurly, Braintree, SagePay etc. and i can also manage server using SSH. etc.Responsible for managing key strategic development projects from conception to production. Expert in Internet marketing, Strategic Business Consulting, E-commerce, Pay Per Click (PPC), Search Engine Optimization (SEO), Email Marketing and Banner Ads, Social Media Consultation and Marketing. Working for Internet Branding & Advertising / SEO industry for over 6 years. Given the fact the change is the only constant in ever evolving digital marketing strategy I tend to keep myself constantly updated and therefore I feel I am as sharp and enthusiastic as I was on the first day of mine as Digital Marketing expert.I am analytical, independent, innovative, able to work under pressure and work well in a team. I work hard to provide best quality work to my clients to help them grow their business.",Prashant Dwivedi,2017-03-02,15.0,"December 4, 2012",24,https://www.upwork.com/freelancers/_~01c6f2fd1d0cc97ba8,8,4.6049940014,upworkResourceCSV_10k_18.csv,
7679,https://odesk-prod-portraits.s3.amazonaws.com/Users:kzmbeautyeditor:PortraitUrl_50?AWSAccessKeyId=1XVAX3FNQZAFC9GJCFR2&Expires=2147483647&Signature=E87rLNFb8nQH%2Bhk6RXyzPmoltLQ%3D&1486081136839747,Writing--Sales & Marketing,Independent,Award winning beauty & skincare authority,editorial-writing--content-writing--blog-writing--copywriting--public-relations--wordpress--social-media-marketing--media-relations--article-writing,United States,"Internationally sought-after Beauty Expert with experience in both print and online media. Expertise in high end boutique  & mass market, with strong background in ingredients and formulation. Award winner eco-beauty and wellness blogger. Professional background as esthethician and makeup artist. In the beauty industry since 1995.Consultant & sales trainer to beauty and skincare brands. Social media marketing, press release writing, website content and copywriting experience.",Karley Ziegler Mott,2017-03-02,30.0,"April 13, 2009",,https://www.upwork.com/freelancers/_~01e6642e96ba840631,,4.9814001513,upworkResourceCSV_10k_17.csv,
9114,https://odesk-prod-portraits.s3.amazonaws.com/Users:copymasters:PortraitUrl_50?AWSAccessKeyId=1XVAX3FNQZAFC9GJCFR2&Expires=2147483647&Signature=hAOpDheM4ycsZlpkZ9SpRAlTcjs%3D&1476788905283598,Writing--Sales & Marketing--Design & Creative--Accounting & Consulting,Independent,"Great Copy That Sells, Copywriter, Sales & Marketing Consultant.",html5--content-writing--creative-writing--business-writing,United Kingdom,"Utilising my expertise, high quality real world copy, and market proven strategies I will advance and complete your project in the shortest possible time and at an exceptionally affordable investment cost! Please take a moment to read my reviews. Hello and Welcome To Great Copy That Sells! & The Sales Copy Doctor. Let me introduce myself , I'm a successful marketer, copywriter,  consultant with 32 years experience in the real world of marketing. My personally produced  sales copy has  been snail-mailed over one million times  ,read on the internet millions of times more and has produced millions in revenues, both for myself and my clients.  Seven years ago I took early retirement, but after a couple of years of holidaying, cruising and writing novels I found that I missed the marketing world, so I registered on a couple of website such as this to offer my services as a copywriter/ ghost writer, marketing consultant. As you are reading this you have found one of these sites. I now get involved with projects that interest me, as a means of keeping my marketing mind sharp.       I offer a wide range of marketing services including copywriting, sales strategies, brand building, customer acquisition and retention, funnel building, sales videos and  ghost writing  With each project I bring over 30 years practical experience to the table, experience that can eradicate expensive mistakes before they are made,experience that can offer a fast track to both success and profit, in the shortest possible time and at very reasonable investment.   The quality of the work and advice I give can be seen in the reviews and testimonials clients leave. I produce high quality sales copy, websites, sales emails, intro / sales videos, ghost writen projects and marketing consultancy services on a one to one basis. I do NOT outsource any copywriting or marketing strategies services. All clients for these services deal directly with me. Please feel free to contact me to discuss your requirements and to see if my experience and expertise can be of benefit to you and your business.  ",Patrick A.,2017-03-02,30.0,"August 8, 2010",6,https://www.upwork.com/freelancers/_~01126490488d667be3,,4.8663048625,upworkResourceCSV_10k_17.csv,
10644,https://odesk-prod-portraits.s3.amazonaws.com/Users:ahoff-domin:PortraitUrl_50?AWSAccessKeyId=1XVAX3FNQZAFC9GJCFR2&Expires=2147483647&Signature=ihSD4AiFv2Zrs%2FEpbHnpohBd1w8%3D&1452018579203514,Translation--Writing--Admin Support--Accounting & Consulting,Independent,Writer and Translator English-German,project-planning--english--translation-english-german--german--u.s.-culture--business-writing--financial-writing--startup-consulting--business-coaching--business-management,United States,"I have thirty years of experience in the financial, business and real estate sector. In my projects and business activities I take into account the cultural diversity to make the business transaction as smooth as possible.My findings I have also published in several books.",Andrea Hoff-Domin,2017-02-20,20.0,"January 5, 2016",,https://www.upwork.com/freelancers/_~01ce1ddfa700ed68dd,4,5.0,upworkResourceCSV_10k_18.csv,
5485,https://odesk-prod-portraits.s3.amazonaws.com/Users:burein44:PortraitUrl_50?AWSAccessKeyId=1XVAX3FNQZAFC9GJCFR2&Expires=2147483647&Signature=KOdjHo4sFHnl8Mjmkf%2FyaKZX2%2F0%3D,Writing--Legal--Admin Support--Design & Creative--Sales & Marketing,Independent,Japan Specialist,translation-japanese-english--translation-english-japanese--proofreading--editing--research--creative-writing,United States,"Writer, translator, proof reader and research specialist.  It is important to me to provide great professional service to clients.  I take pride in my work and having great communication with clients.  I have experience teaching English to people who are learning English as a second language.I excel at travel, culture, and sports writing.  I have written for travel/culture websites and sports websites.  I can also provide travel tips/advice and other assistance for travel in Japan and all of South East Asia.I do Japanese-English pair translations. I am a native English speaker and pay close attention to detail when proofreading others work.I am excellent at doing all kinds of research especially on the internet.",Blaine B.,2017-03-01,25.0,"April 5, 2012",1,https://www.upwork.com/freelancers/_~0193399e9759c53204,4,4.9576163431,upworkResourceCSV_10k_16.csv,
13539,https://odesk-prod-portraits.s3.amazonaws.com/Users:valerioal:PortraitUrl_50?AWSAccessKeyId=1XVAX3FNQZAFC9GJCFR2&Expires=2147483647&Signature=P84FBhxeajW7d0%2FiqIROlhm60pg%3D&1482509361735763,Writing,Independent,"Medical Writer, EN-PT translator",writing--medical-writing--scientific-writing--scientific-research--medical-translation--translation-portuguese-english--translation-english-portuguese--proofreading,Portugal,"I am a Pharm-D graduate available to work in PT-EN translation or writing projects within the science/medical/healthcare area. I am a Native Portuguese speaker, with strong command of English language. I have good knowledge of health and medical terminology adquired during my academic background and work experience, as well as experience in writing and I'm qualified to develop scientific information or materials to be used by healthcare professionals, patients or the general public.In every assignment, I focus on delivering excellent results according to the client's expectations. If you'd like me to work in your project, I am looking forward to hear from you.",Ana Valerio,2017-03-02,12.0,"December 23, 2016",,https://www.upwork.com/freelancers/_~01b47b61bfadbabdc1,4,0.0,upworkResourceCSV_10k_2.csv,
754,https://odesk-prod-portraits.s3.amazonaws.com/Users:lucysarahmills:PortraitUrl_50?AWSAccessKeyId=1XVAX3FNQZAFC9GJCFR2&Expires=2147483647&Signature=BYoMF%2Fl26emVAYm1kDj%2FDOIxxc4%3D&1488290931866065,Writing,Independent,Creative and Non-fiction Writer,english-proofreading--english-grammar--english-spelling--creative-writing--blog-writing--creative-strategy--adobe-premiere--adobe-photoshop--final-cut-pro-x--fiction-writing,United Kingdom,"Hello!My experience in freelance writing is broad. For 6 months I have been writing for MyTreadingStories.com, writing blog posts and articles from film to lifestyle. Prior to that I was writing for Student Engine for 8 months writing to briefs for students by students. My most recent writing was for artweek.com. Finally I have creative writing experience, writing my own short films that have been produced. I am a graduate from the University of Westminster studying Contemporary Media Studies with First Class Honors. This consists of film production, photography and expanded media.I learn quickly and adapt to what is needed, from my work as a 1st assistant director on short films I've learnt to work well under pressure and solve problems quickly to provide the best creative outcome.  Meaning I can work under pressure well, confidently and proactive to get the job done to the highest standard. At University I was motived and initiative to finish all my modules on time and multi-task different projects at the same time.  ",Lucy Mills,2017-03-01,30.0,"February 28, 2017",1,https://www.upwork.com/freelancers/_~01eecef4f5306cfd49,,0.0,upworkResourceCSV_10k_0.csv,
4357,https://odesk-prod-portraits.s3.amazonaws.com/Users:ksenn:PortraitUrl_50?AWSAccessKeyId=1XVAX3FNQZAFC9GJCFR2&Expires=2147483647&Signature=AXcSLEYuF8e4O3%2Bi2uSaPJNiY9w%3D&1444747998945780,Writing,Independent,Educated and Experienced Freelance Writer and Editor,seo-writing--blog-writing--article-writing--product-descriptions--proofreading--creative-writing--business-writing--research-papers--sales-promotion--content-writing,United States,"I began freelance writing while at university where I studied business and equestrian administration. I wrote and edited many research articles (random topics-world history, business ethics, how brilliant Bob Dylan was, defining the Beatnik generation, etc.) for various clients as well as assisted a GM of a large Mercedes dealership with daily writing tasks and creating promotional material. Following university I volunteered in the Peace Corps for two years where I did A TON of grant writing and non-profit work. I was trained by one of the best organizations on how to write winning, effective grants which propelled my writing skills into new, different areas of writing. Now I freelance to stay independent and work from the road. My husband is a freelancer in the film industry so we are always on the move. When not on the set, we travel, I fly fish, ride horses and stay active in many different ways. I am never too far away from my computer. Please contact me at anytime!",Katalyn Hanes,2017-03-02,20.0,"August 7, 2014",3,https://www.upwork.com/freelancers/_~01654583c2fd16c9bf,,4.8565527416,upworkResourceCSV_10k_1.csv,
4817,https://odesk-prod-portraits.s3.amazonaws.com/Users:aris-sandrea:PortraitUrl_50?AWSAccessKeyId=1XVAX3FNQZAFC9GJCFR2&Expires=2147483647&Signature=HK%2Flodt3r4mzOh4dGhklqCqykW0%3D&1473974738871626,Translation--Writing,Independent,SEO writer & Translator,translation-english-spanish--translation-spanish-english--content-writing--blog-writing--seo-writing--article-writing--copywriting,Venezuela,"I'm a professional SEO writer and translator of ENG-SPA. My proficient writing skills guarantee smooth yet interesting articles focusing on keywords and targeting your specific audience. By hiring my services you can expect professional behavior, great results and deliveries on time. If what you are looking for is an article or a translation just message me! Regards, Aris S. ",Aris S.,2017-02-21,10.0,"September 15, 2016",1,https://www.upwork.com/freelancers/_~016afd4e34a62a9ee8,3,4.9665954035,upworkResourceCSV_10k_1.csv,
2636,https://odesk-prod-portraits.s3.amazonaws.com/Users:felicitybox:PortraitUrl_50?AWSAccessKeyId=1XVAX3FNQZAFC9GJCFR2&Expires=2147483647&Signature=VPNHkOT2gXdOx%2B%2BonzD%2F3wZ0qK0%3D&1451770126664553,Writing--Translation--Sales & Marketing,Independent,Freelance Copywriter,translation-spanish-english--copywriting--seo-writing--writing--blog-writing--proofreading--article-writing--content-writing--microsoft-word,United Kingdom,"I am a highly competent and talented freelance writer with more than 3 years' professional experience. I research and write high quality content for websites, blogs and online magazines. I am also fluent in Spanish and have completed several translation projects from Spanish to English. ",Felicity Box,2017-03-02,16.67,"May 22, 2012",,https://www.upwork.com/freelancers/_~01dbdc5ca4f053e6dd,,4.9880821431,upworkResourceCSV_10k_1.csv,
5612,https://odesk-prod-portraits.s3.amazonaws.com/Users:nicolette_tomlin:PortraitUrl_50?AWSAccessKeyId=1XVAX3FNQZAFC9GJCFR2&Expires=2147483647&Signature=WziXsdUxHHRpeYWDf8ZgRkIjJQI%3D&1466384253623615,Writing--Admin Support,Independent,"Health, Natural Hair, Gardening, Travel & Ebook, Copywriter",content-writing--blog-writing--medical-writing--academic-writing--creative-writing--copywriting--seo-writing--internet-research--social-media-management--nursing,Jamaica,"Looking for an excellent writer who adheres to deadlines and produces quality work? Well, then you are at the right place. I am a very skilled writer who produces excellent materials relating to Travelling, Health, Fitness, Academic Writing (APA) and Natural Hair Care etc for my clients. I am widely knowledgeable in several subject areas. I have outstanding leadership qualities, management and competitive skills with abilities to plan and organize. I consider myself to be a jack of many trades as I use all my skills to enhance and craft new and exciting opportunities for my clients and myself.Health is my passion!!!I PREFER HOURLY CONTRACTS.",Nicolette T.,2017-03-02,30.0,"May 16, 2016",,https://www.upwork.com/freelancers/_~01e415a549361a1154,4,5.0,upworkResourceCSV_10k_16.csv,
15875,https://odesk-prod-portraits.s3.amazonaws.com/Users:abriellel98:PortraitUrl_50?AWSAccessKeyId=1XVAX3FNQZAFC9GJCFR2&Expires=2147483647&Signature=H7NxPyHGpNSLGTkN8IHADTun8Ow%3D&1487580393537399,Writing,Independent,Blog/Social Media Design Specialist,social-media-management--writing--creative-writing--creative-strategy--blog-writing--blog-development,United States,I have experience with writing blogs and managing social media. I managed all of the social media for my high school and my first college. I also have a few social media accounts of my own. I try to make any social media account I have control of as aesthetically pleasing as I possibly can. Art and thinking creatively mean everything to me. I hope I can help!,Aimee Lewis,2017-02-20,14.0,"February 20, 2017",,https://www.upwork.com/freelancers/_~017bf87bc333874cde,,0.0,upworkResourceCSV_10k_3.csv,
6595,https://odesk-prod-portraits.s3.amazonaws.com/Users:ayesha-abbasi:PortraitUrl_50?AWSAccessKeyId=1XVAX3FNQZAFC9GJCFR2&Expires=2147483647&Signature=xE2CnjMsgMslK42l0kkp4r9pTn4%3D&1485915851354388,Writing,Independent,Proofreader and Copy Editor,english-proofreading--editing--article-rewriting--article-writing--blog-writing--microsoft-word--microsoft-powerpoint--adobe-pdf,Pakistan,"Hello there!I can proofread and edit any written or spoken English work/material.I write articles and blogs in simple, clear, and easily understandable English.My work is always timely and satisfying. I make sure to always meet my client's requirements, and deliver work of excellent quality.I work passionately, and give my project all I have.Contact me if you think I can provide any services to you.",Ayesha Abbasi,2017-03-01,10.0,"January 27, 2017",,https://www.upwork.com/freelancers/_~01ea71f9595f88bc9a,,5.0,upworkResourceCSV_10k_16.csv,
