,portrait_50,categories2,profile_type,title,skills,country,description,name,last_activity,rate,member_since,portfolio_items_count,id,test_passed_count,feedback,filename,alreadyMessaged
8668,https://odesk-prod-portraits.s3.amazonaws.com/Users:codynailor:PortraitUrl_50?AWSAccessKeyId=1XVAX3FNQZAFC9GJCFR2&Expires=2147483647&Signature=9TDq7dKF7RNRXZubgoGGciTavd8%3D&1464193611382459,Design & Creative--Admin Support--Writing,Independent,Writer. Reader. Musician.,,United States,"Recent graduate of Lee University, a liberal arts college, with a Bachelor of Arts in Humanities. Co-founder and co-manager of my band, The Giant & The Tailor.",Cody Nailor,2017-03-02,15.75,"July 8, 2013",,https://www.upwork.com/freelancers/_~017b45c9ce64cb5ebf,,0.0,upworkResourceCSV_10k_17.csv,
16163,https://odesk-prod-portraits.s3.amazonaws.com/Users:humblejeff:PortraitUrl_50?AWSAccessKeyId=1XVAX3FNQZAFC9GJCFR2&Expires=2147483647&Signature=NHUa1QdDcxpAWKmKOxqFQyI0A%2F0%3D,"Writing--Sales & Marketing--Admin Support--Web, Mobile & Software Dev--Accounting & Consulting",Independent,seo and academic writer,technical-writing--seo--proofreading,Kenya,Making a difference through writing,Jeff Mwaniki,2017-02-24,11.11,"June 15, 2011",,https://www.upwork.com/freelancers/_~014a5f4b834c0c784b,3,0.0,upworkResourceCSV_10k_3.csv,
5897,https://odesk-prod-portraits.s3.amazonaws.com/Users:istvan-zseller:PortraitUrl_50?AWSAccessKeyId=1XVAX3FNQZAFC9GJCFR2&Expires=2147483647&Signature=wYi3U%2FwEQvpPzXwRsIEq7qycP9g%3D&1457104054361571,Translation--Writing--Admin Support--Design & Creative,Independent,journalist,translation-english-hungarian--translation-serbian-english--sdl-trados--nursing--wordpress--photography--medical-transcription--linux-system-administration--article-writing--customer-service,Serbia,"I am a Hungarian journalist and translator. I have 17+ years of experience in the field, and I was a a newspaper editor for 3 years. I translated MessageBird messaging platform and All-in-One SEO plugin for Wordpress into Hungarian. I still serve as a translator and proofreader at these projects. I have been working as a translator of law related text for the past 3 years.My articles were cited in scientific works and journals. I have over 4000 hours on Upwork. I 've been taking part in a bunch of localization projects for the past 6 years, among them games and various software. As a broadcast journalist I had quite a few voice-over gigs, where I narrated news, training materials, and ads. I was working for a large San Francisco Bay company for 3 years and as a freelancer had an international clientele. If you are interested, please contact me.",Istvan Zseller,2017-03-01,15.11,"January 10, 2012",15,https://www.upwork.com/freelancers/_~012a506b68e6542c5e,6,3.4168315708,upworkResourceCSV_10k_16.csv,
11935,https://odesk-prod-portraits.s3.amazonaws.com/Users:yoshieb:PortraitUrl_50?AWSAccessKeyId=1XVAX3FNQZAFC9GJCFR2&Expires=2147483647&Signature=iqztTC21gMwpw3qihvGXGFZ%2Bozw%3D&1486675505175576,"Writing--Web, Mobile & Software Dev--Admin Support",Independent,Quality Assurance and Product Manager,blog-writing--creative-writing--research--software-qa-testing--regression-testing--management-skills,United Arab Emirates,QA Tester with experience is working in an Agile SDLC . 2 Years experience in Manual Testing. Love to write stories & epics and manage teams as well as stream line processes. Analytical thinker & Adaptable towards changeCurrently working with 2 Freelance Clients as a QA Lead. ,Yoshita Bhatia,2017-02-17,10.0,"February 9, 2017",,https://www.upwork.com/freelancers/_~01443a6292724936a3,,0.0,upworkResourceCSV_10k_19.csv,
17062,https://odesk-prod-portraits.s3.amazonaws.com/Users:maja_lukovic:PortraitUrl_50?AWSAccessKeyId=1XVAX3FNQZAFC9GJCFR2&Expires=2147483647&Signature=8cKMshx5Sh7p466AJOb88g6um%2BQ%3D&1452335643971530,Writing,Independent,"writer, translator",writing--translation--teaching-english--serbian,Serbia,"I write, translate, research, teach and much more. I am usually honest, but could be a good liar if needed.",Maja Lukovic,2017-02-27,20.0,"January 9, 2016",,https://www.upwork.com/freelancers/_~0170b88ce451ef1b31,,0.0,upworkResourceCSV_10k_5.csv,
3317,https://odesk-prod-portraits.s3.amazonaws.com/Users:nitish_singh:PortraitUrl_50?AWSAccessKeyId=1XVAX3FNQZAFC9GJCFR2&Expires=2147483647&Signature=FPuJbBlZ4uq%2FucfN%2F%2FTKuO43FZ0%3D&1473240954209343,"Web, Mobile & Software Dev--Writing",Independent,"Programmer, Writer and Researcher",writing--wordpress--research--technical-writing,India,"Working as a writer for the past one year, I have developed a keen interested in technical writing. I have worked on different types of content niche including business, ERP, CRM, technical reviews, WordPress copyrighting and other types of content that are closely related to technology or business.I am also well versed with some of the prominent programming languages such as Python, Java, C++, and C. I have an introductory level of knowledge in front-end technologies such as HTML5, CSS3, and JavaScript(I have created few responsive design layouts using the technologies).I love website optimization and have done a lot of projects regarding the same. You can find my gigs on Fiver on Website Optimization. WordPress writing is my strongest technical sub-niche where I excel. I have written for the likes of 85Ideas(one of the leading WordPress blogs), IndexWP, SourceWP. I have also written for a leading web resource portal, BestFreeWebResources.com.Currently, I am also doing personal projects by creating authority websites. The first website is TechAltair.com which is focused on developing content around online learning, technology and development. Another website is a WordPress related website, WPPrism.com, which focuses on WordPress related content.Both of the websites are in the infant stage.I am also focused on exploring the different aspects of technology and programming languages.You can contact me for any content writing requirement. I am more than eager to help you out.",Nitish S.,2017-03-02,20.0,"February 3, 2014",5,https://www.upwork.com/freelancers/_~018184c0f1ec19675b,7,4.856760446,upworkResourceCSV_10k_1.csv,
11046,https://odesk-prod-portraits.s3.amazonaws.com/Users:reotutar:PortraitUrl_50?AWSAccessKeyId=1XVAX3FNQZAFC9GJCFR2&Expires=2147483647&Signature=wryjfDuM9zczX7q5%2Bz%2FmRqhGp78%3D&1487178557531623,Writing,Independent,"Versatile Copywriter, Journalist, and Resume Writer",content-development--copy-editing--resume-writing--seo-writing--cover-letter-writing--linkedin-api--web-services--newsletter-writing--news-writing-style--copywriting,United States,"I am a Chicago-based freelance writer with more than 10 years as a resume writer, copywriter, financial writer, blogger, journalist, and editor for diverse companies in multiple industries, including financial services, healthcare, and tax law.During my career, I have applied my proven expertise and ongoing professional development to meeting and exceeding all objectives put before me. In my most recent role, I plan, develop, edit review, and proofread content for web pages, landing pages, and marketing/promotional material for a start-up online financial education website, futurebuck.com and built and managed a team of 10 financial writers and more than 20 Subject Matter Expert reviewers for programs content. My other professional experience includes: researching, writing, editing, and proofreading product summaries for more than 100K office products.. writing, editing, and proofreading resumes, cover letters, LinkedIn profiles, executive biographies and other job-related informational material for clients.. and researching, writing, editing, and reviewing complex tax laws, regulations, and cases. Additionally, I have a strong background editing and proofreading marketing material, ranging from newsletters and B2C/B2B marketing collateral to feature articles for publications. I also have extensive experience using the AP Style Guide and Chicago Manual of Style. Finally, I have more than 10 years of experience working remotely from a fully equipped home office.I am immediately available for a full-time or part-time role.",Robert Reotutar,2017-02-17,25.0,"February 15, 2017",,https://www.upwork.com/freelancers/_~0149b92eeb77b4963e,,0.0,upworkResourceCSV_10k_18.csv,
11906,https://odesk-prod-portraits.s3.amazonaws.com/Users:retory:PortraitUrl_50?AWSAccessKeyId=1XVAX3FNQZAFC9GJCFR2&Expires=2147483647&Signature=Soe945I1Xqrf5wZKeYafAJdk1JY%3D&1487418151403216,Translation--Design & Creative--Writing,Independent,Power Point Professional,microsoft-powerpoint--canva--canvas--slideshare--microsoft-excel,United States,"I have been prepairing professional presentations for more than 2 years. Company overviews, general informational presentations have been made by me.My presentations include multycharts, many icons, many multimedia information. Provide tramsformation of any information into charts and iconic representation.",Ann Teaffy,2017-02-18,10.0,"February 18, 2017",,https://www.upwork.com/freelancers/_~012714a4d022ad37b5,,0.0,upworkResourceCSV_10k_19.csv,
17499,https://odesk-prod-portraits.s3.amazonaws.com/Users:catarinadea:PortraitUrl_50?AWSAccessKeyId=1XVAX3FNQZAFC9GJCFR2&Expires=2147483647&Signature=HH1SigM8y55Q%2Fp9KpyOJwY3KMco%3D&1462995480898507,Writing,Independent,Curiosity keeps leading us down new paths,creative-writing--business-writing--article-writing--content-writing--travel-writing--technical-writing--speech-writing--social-media-marketing--translation-spanish-english--translation-english-portuguese,Brazil,"Knowledge, curiosity and creativity walk together, always. I've been working with copywriting, creative writing, business writing, content writing and article writing for three years. With more than 100 texts around the internet, my goal is to make people to feel interested and captivated about a subject that can be easily comprehended. So, I want to share my experience and be able to spread knowledge through writing something that can make a difference in people's lives. ",Catarina Dea,2017-03-02,10.0,"July 13, 2015",,https://www.upwork.com/freelancers/_~0154e638f6a84273ee,,0.0,upworkResourceCSV_10k_7.csv,
12458,https://odesk-prod-portraits.s3.amazonaws.com/Users:gvyck:PortraitUrl_50?AWSAccessKeyId=1XVAX3FNQZAFC9GJCFR2&Expires=2147483647&Signature=rToV2uEo5koAiq%2Bx83uKR0kTPgo%3D&1485823283463843,Writing,Independent,"Creative writer, editor, translator, overachiever in everything I do",lyrics-writing--comic-writing--translation--transcription,Venezuela,"Bachelor in Modern Languages. I won several writing contests during my college years in horror short stories, romance, comedy and poems. Also have experience dealing with customers (worked as a Telemarketer), Human Resources and Brokerage.",Genesis Navas,2017-02-24,12.0,"January 30, 2017",,https://www.upwork.com/freelancers/_~01c2b624b23155e446,,5.0,upworkResourceCSV_10k_2.csv,
224,https://odesk-prod-portraits.s3.amazonaws.com/Users:leorydel:PortraitUrl_50?AWSAccessKeyId=1XVAX3FNQZAFC9GJCFR2&Expires=2147483647&Signature=fum2XcSoB09cw4szahHyt3pO9ak%3D&1483855773178378,Writing--Sales & Marketing,Independent,"Blog, Article, and Creative Writer",adobe-photoshop--adobe-illustrator--garageband--logic-pro--protools--microsoft-word--microsoft-excel--microsoft-powerpoint--apple-imovie,United States,"Creative, results-oriented, and reliable freelance writer, editor and content creator with over 4 years of experience writing for various blogs, online forums, online magazines, and publications. Experience utilizing social media best practices, marketing techniques, and WordPress. A thriving individual who meets deadlines and manages workflow. ",Leo Rydel,2017-02-28,17.0,"January 7, 2017",,https://www.upwork.com/freelancers/_~01438f4db53dfb0840,,0.0,upworkResourceCSV_10k_0.csv,
8136,,Translation--Writing,Independent,"Freelance pianist, writer and translator",translation-french-english--english-spelling--translation-english-french,Canada,"I am an experienced Translator (French-English), Writer and Music Educator. After working in-house as a translator for a renowned Canadian company, I have moved on to freelancing and am open to help with many different types of project. I also have great experience with writing, including ebooks and press releases. ",Andree-Ann Deschenes,2017-03-02,25.0,"January 13, 2011",,https://www.upwork.com/freelancers/_~0112f6b04038d09446,,4.8653637996,upworkResourceCSV_10k_17.csv,
3059,https://odesk-prod-portraits.s3.amazonaws.com/Users:majabaek:PortraitUrl_50?AWSAccessKeyId=1XVAX3FNQZAFC9GJCFR2&Expires=2147483647&Signature=khFZLgmN4ywRw0hxy9qCnm3WN7k%3D&1470768414093027,Translation--Writing,Independent,"Creative writer, proofreader and feedback-giver/editor",content-writing--creative-writing--editing--proofreading--translation,Denmark,"I've recently graduated from University of Wales TSD with a BA in Creative Writing. I speak both Danish and English fluently and can help out with both your creative writing needs as well as any translation in regards to those two languages. I write a lot of short stories and poems myself and have often read through my friends' work to proofread, give feedback, and edit when needed. I am happy to work quite a bit for a low fee as I am new to the freelancing business and I am eager to get some jobs and some good contacts to get started. ",Maja Baek,2017-03-01,10.0,"August 9, 2016",,https://www.upwork.com/freelancers/_~01791eb76c4138e48d,,0.0,upworkResourceCSV_10k_1.csv,
9688,https://odesk-prod-portraits.s3.amazonaws.com/Users:caswani:PortraitUrl_50?AWSAccessKeyId=1XVAX3FNQZAFC9GJCFR2&Expires=2147483647&Signature=W6Pv9lXoXNz7m%2FwPzqli6%2FHgHG8%3D&1473729710730981,Writing,Independent,Copywriter. Editor. Resume writer. Excavator of stories.,copywriting--english-proofreading--editing--resume-writing--blog-writing--article-rewriting--customer-service,United States,"I am a freelancer with diverse strengths and experience to assist you.  I have edited business plans, proposals, research papers, essays and e-mails. Meticulous attention to detail and a passion for grammar allow me to help make your project a reality. As a strong communicator, I am able to facilitate editing & rewriting to help you clarify the voice of your work.Passionate about story-telling, I have been featured on annapurnaliving.com and would love to tend your stories with the utmost care. ",Cassandra Aswani,2017-03-02,12.0,"September 12, 2016",,https://www.upwork.com/freelancers/_~018721b8e2783faf13,9,5.0,upworkResourceCSV_10k_18.csv,
1514,https://odesk-prod-portraits.s3.amazonaws.com/Users:veramicic:PortraitUrl_50?AWSAccessKeyId=1XVAX3FNQZAFC9GJCFR2&Expires=2147483647&Signature=nOOgqFAdnyNEHdUXszmmGoyB5KY%3D&1468257049557986,Writing,Independent,Writer | Ghostwriter,fiction-writing--creative-writing--ghostwriting--ebook-writing--blog-writing--microsoft-word,Serbia,"I have had a strong passion for the written word since the early childhood. After I started writing novels at the age of 9, I realized my dream to become a writer one day.Writing as a freelancer enables me to unleash my creativity and enjoy what I like the bestwriting. I have experience with creative writing, ebook, blog writing, and ghostwriting.Beside working as a freelancer, I currently write my YA sci-fi/fantasy and romance novels that I publish regularly on the writing platform Wattpad, and I plan to publish them traditionally one day. Also, I write genuine articles for my blog.I have a Bachelor's degree in journalism. I am fluent in English, detailed, organized, and I always do assignments within given time frame/schedule.Years of creative writing experience are behind me, and I hope I can gain much more experience and opportunities here on Upwork.",Vera M.,2017-02-25,10.0,"July 10, 2016",3,https://www.upwork.com/freelancers/_~01f3dede298bf7446f,3,4.9695431472,upworkResourceCSV_10k_0.csv,
11663,https://odesk-prod-portraits.s3.amazonaws.com/Users:garnertony:PortraitUrl_50?AWSAccessKeyId=1XVAX3FNQZAFC9GJCFR2&Expires=2147483647&Signature=8vaxBevX44y%2FVt%2F49X2OeIv2L7g%3D&1487573475183128,Writing,Independent,ESL Materials Designer,content-writing--english-grammar--english-spelling--esl-teaching,Japan,"I have taught ESOL since 2007 and completed a Trinity Diploma in TESOL in 2015. My extensive classroom experience means I know what kind of materials teachers are looking for. Whatever the setting and course type, I can produce attention-grabbing lesson plans that integrate the key skills and are easy to follow.",Tony Garner,2017-02-26,25.0,"February 17, 2017",,https://www.upwork.com/freelancers/_~01e39fe65516d2b6dd,,0.0,upworkResourceCSV_10k_19.csv,
4473,https://odesk-prod-portraits.s3.amazonaws.com/Users:eloddo:PortraitUrl_50?AWSAccessKeyId=1XVAX3FNQZAFC9GJCFR2&Expires=2147483647&Signature=tMPytxN2iXRElldNTNnL08%2FX09Q%3D&1488394719645662,Translation--Writing--Sales & Marketing--Customer Service--Admin Support,Independent,"Digital Marketing, content writing, customer support, translation",translation-italian-english--social-media-marketing--content-writing--online-community-management--internet-marketing--customer-support--translation-english-italian--administrative-support--content-marketing--facebook-marketing,Italy,"Why should you hire me? I am independent - give me a few instructions and I will bother you only if and when necessary. I have been working for two years on Upwork successfully completing several projects in various fields.Prices vary on the projects.I can offer the following services: Digital marketing consulting services (social media marketing included) I can guarantee 100% quality translations (Italian-English, English-Italian, Italian-Spanish, Spanish-Italian, English-Spanish, Spanish-English).. I can write brand new texts.. I can manage to proofread texts.. I can produce SEO (and not SEO) content on many topics.. I can translate and create content for websites and blogs..I can guarantee 100% multilanguage customer satisfaction oriented service, through a patient but a firm attitude with difficult customers and customer disputes, maintaining high standards and observing work ethics.Education is focused on communication, linguistics, and digital marketing.. holds a Bachelor Degree in Communication and Foreign Languages and a Master Degree in Digital Marketing strategies. Work experience related to Social Media Marketing, translation, content writing and customer service.Italian native speaker. 100% fluent in English and Spanish (both written and spoken).I would love to talk with you to see if I can help you with your business needs. Emanuela",Emanuela L.,2017-03-02,16.0,"August 12, 2014",15,https://www.upwork.com/freelancers/_~012a43c8dcdc1a8f92,15,4.6544552881,upworkResourceCSV_10k_1.csv,
4246,https://odesk-prod-portraits.s3.amazonaws.com/Users:8ebba21e:PortraitUrl_50?AWSAccessKeyId=1XVAX3FNQZAFC9GJCFR2&Expires=2147483647&Signature=rGqaDBn9gIrQCF4H7OA1q2NxTkk%3D&1431001923665956,Writing,Independent,Writer and Editor,,United States,"I have more than 30 years experience as a newspaper and freelance editor with an emphasis on nonfiction work. My recent projects include writing and editing content for USATodays Travel Tips and Livestrong.com, among others. As a PGA professional, I have integrated my golf and communications skills as a writer and editor for GolfLink.com and as the section editor and expert for Golfsmith.coms Golf Tips. I earned a degree in journalism and communications from Point Park University in Pittsburgh, and then began a 15-year career in newspapers before following my dream of becoming a golf professional. I now serve as teaching professional at a small private club in Pennsylvania in the summers and in California in the winters. My current projects include reviewing copy editors for an online company and working on a golf instruction book.",Kim Kleinle,2017-03-02,25.0,"April 11, 2013",,https://www.upwork.com/freelancers/_~0113f6e639749ef83b,1,4.7813213821,upworkResourceCSV_10k_1.csv,
1813,https://odesk-prod-portraits.s3.amazonaws.com/Users:erlaneaudrie:PortraitUrl_50?AWSAccessKeyId=1XVAX3FNQZAFC9GJCFR2&Expires=2147483647&Signature=Q8lA3As7ObJJ0sFuiiMFy6mcuyo%3D&1470031564882404,Writing--Admin Support,Independent,"Creative and Technical Web Content, Copywriter, and Researcher",creative-writing--social-media-optimization--english-proofreading--qualitative-research--technical-writing--seo--editing--content-writing--blog-writing--seo-writing,Philippines,"My background in academic research and creative writing enabled me to quickly adapt different styles of writing that targets specific audiences or groups. I have been doing field works, case studies, and group discussions that required the collation of data and organized summary from multiple sources of information. I am confident that I can finish the work in the given amount of time. Aside from content writing, I underwent a one month training in search engine optimization and I learned how to write articles that can land on Googles top search page. As an example, I wrote an article about Tiffany Hwang of SNSD or Girls Generation. The writing task that was part of my paid on-the-job training last year 2016, was successful since my article claimed the second and third spot for about two weeks from the time of publication. I utilized the Search Engine Optimization method in order to do this. Even if Im not part of the company any more, my article is still viewed at present. I have also written numerous articles that gained thousands of views.Kindly search Tiffany Hwang scandal on Google and click on my article, titled SNSD Tiffany Removal from Sisters Slam Dunk Due to Japan Rising Sun Flag Scandal Confirmed. You can see that its still on the first page after seven months although its now in the fifth rank. It received 5,000+ clicks the last time I checked it and that was way back August last year (2016). The website that my previous employers are running is still gaining popularity and the four top ranks were claimed by major news websites around the world so landing the fifth spot in the long run is something significant. I graduated from one of the top universities in our country that is widely (not just nationally but also globally) recognized as a reputable research institution. My former professor is known as the first Filipina to obtain both a masters and doctorate degree in the fields of Social and Cultural Anthropology in Oxford. She really influenced me a lot when it comes to writing. I have written academic researches mainly about the fields of the Social Sciences and Humanities  Sociology, Anthropology, Psychology, Philosophy, and History. But I also do creative writing as a hobby. I can create attention-grabbing headlines too that is of course, useful in marketing. Writing as a passion enables me to submit any given work in a short amount of time! Be rest assured that I can deliver a professional output independently.  -------------------------------------------------------------",Lovelyn Angalao,2017-03-02,30.0,"July 23, 2016",10,https://www.upwork.com/freelancers/_~01d8d0d59c3d45a1fe,3,0.0,upworkResourceCSV_10k_0.csv,
4945,https://odesk-prod-portraits.s3.amazonaws.com/Users:n_rados:PortraitUrl_50?AWSAccessKeyId=1XVAX3FNQZAFC9GJCFR2&Expires=2147483647&Signature=DVniPUGtx%2BqNZhk%2F4sOLOSoyf6o%3D&1466161990353949,Writing,Independent,Creative blog and article writer,creative-writing--blog-writing--research--proofreading--wordpress--translation-english-serbian--translation-serbian-english--serbian,Serbia,"I am a professional freelance writer, experienced in blogging on various topics. I have a BA in English from the University of Novi Sad, Serbia. I am hard-working and analytical.",Natasa Rados,2017-02-22,15.0,"June 17, 2016",,https://www.upwork.com/freelancers/_~01b59fb0bd7e6e0848,,5.0,upworkResourceCSV_10k_1.csv,
14557,https://odesk-prod-portraits.s3.amazonaws.com/Users:natasharmse:PortraitUrl_50?AWSAccessKeyId=1XVAX3FNQZAFC9GJCFR2&Expires=2147483647&Signature=KD%2F7xAfncekX1WPtEy%2BxauxGCkk%3D&1480012378918450,Translation--Writing--Customer Service--Admin Support,Independent,Transcriptionist and general wordsmith,transcription--editing--proofreading--creative-writing,South Africa,"I'm a full time freelancer slash pro transcription typist and my passion lies in weaving words in creative and positive ways. Over the last three years I've earned the title of wordsmith by completing projects involving mainly transcription, but also content writing, creating subtitles, articles and blogs as well as Afrikaans translations. The secret of joy in work is contained in one word  excellence. To know how to do something well is to enjoy it. - Pearl S. Buck ",Natasha Harmse,2017-03-02,10.0,"March 4, 2013",,https://www.upwork.com/freelancers/_~0101cd273678a1db2a,,4.5187661779,upworkResourceCSV_10k_20.csv,
10486,https://odesk-prod-portraits.s3.amazonaws.com/Users:a001:PortraitUrl_50?AWSAccessKeyId=1XVAX3FNQZAFC9GJCFR2&Expires=2147483647&Signature=crFIjwCr%2BA09SR3ALaALwY3ZV7Y%3D&1456925996557393,"Writing--Web, Mobile & Software Dev--Admin Support--Design & Creative",Independent,Freelancer specialized in Web Dev and reddit consulting.,javascript--react-js--flux--webpack--wordpress--social-media-marketing--social-media-management--social-media-optimization,Serbia,"I provide reddit consulting, link posting, account building. Whatever you need, reddit-related, I can do it, so feel free to contact me.",Djuradj I.,2017-02-26,11.11,"July 9, 2012",,https://www.upwork.com/freelancers/_~010c493023e14c1f9e,8,4.9196881267,upworkResourceCSV_10k_18.csv,
