,portrait_50,categories2,profile_type,title,skills,country,description,name,last_activity,rate,member_since,portfolio_items_count,id,test_passed_count,feedback,filename,alreadyMessaged
2277,https://odesk-prod-portraits.s3.amazonaws.com/Users:saradaes:PortraitUrl_50?AWSAccessKeyId=1XVAX3FNQZAFC9GJCFR2&Expires=2147483647&Signature=2STh4H7msuP6eYgY43oKhNPAsLA%3D&1450724547836231,Writing--Translation,Independent,"Science and Medical writer, Neuroscientist",medical-writing--academic-writing--blog-writing--translation-english-portuguese--translation-portuguese-english,Portugal,"Biochemist with a PhD in Neuroscience. Experienced science and medical writer. During my academic training, I published a number of research articles which gave me profuse experience in academic writing, proofreading, and editing, as well as extensive reference research skills. While I was finishing my PhD, I started working as a science and medical writer and it soon became my preferred activity. Meanwhile, I became the Section Editor for Health and Healthcare at Brain Blogger, a neuroscience communication platform run by the Global Neuroscience Initiative Foundation (GNIF). I have also collaborated with a number of other institutions and companies, not only as a writer, but also as a neuroscience consultant.I can therefore write for different types of public, be it layman, or a highly specialized technical audience.I am a native Portuguese speaker but I am fluent in English. I hold a Cambridge Certificate of Proficiency in English (CPE) that I passed at grade A. I started learning English when I was 9 years old and I have used it throughout my academic and professional life. I have wide vocabulary and grammar skills in both languages.I am professional, tenacious and hard-working.. I am also honest and responsible, I will only commit if I know I can meet your goals and deadline.",Sara Adaes,2017-03-02,30.0,"January 2, 2014",,https://www.upwork.com/freelancers/_~0136239dd7e566052d,,5.0,upworkResourceCSV_10k_0.csv,
11847,https://odesk-prod-portraits.s3.amazonaws.com/Users:myram93:PortraitUrl_50?AWSAccessKeyId=1XVAX3FNQZAFC9GJCFR2&Expires=2147483647&Signature=G4kEq1Q%2BkvHsD4ro3XZ2fFVZHHY%3D,Writing--Translation,Independent,"Writer, Editor/Proofreader and Translator",translation-urdu-english--translation-english-urdu,Brunei Darussalam,"Content is my forte, and adaptability my key skill, having previously written and edited in a variety of areas from lifestyle to property, pop culture to education. My accumulated 2+ years of experience within the field, as well as in marketing and copywriting greatly enhance me as an individual. ",Myra Mitha,2017-02-26,18.0,"March 16, 2014",1,https://www.upwork.com/freelancers/_~01cce2b2124d1a4b4f,,0.0,upworkResourceCSV_10k_19.csv,
3536,https://odesk-prod-portraits.s3.amazonaws.com/Users:f2c4d87b:PortraitUrl_50?AWSAccessKeyId=1XVAX3FNQZAFC9GJCFR2&Expires=2147483647&Signature=lUHMgZ7zHmSIHAwtMrJKEidnoWY%3D&1441255504382906,Writing,Independent,"content developer, ezine expert, copywriter",content-writing--business-writing--article-writing--copywriting--academic-writing--fiction-writing--financial-writing--ghostwriting--medical-writing--non-fiction-writing,Pakistan,"I am a freelance writer with skills in article writing and various other styles of writing. I have nearly 5 years experience in developing content for ezine, blogs and for websites. I also am a SEO expert and creative author and I know how to optimize a website in Google search engine. I have been writing virtually my whole life and definitely have a true heart for the art form. I have an eye for detail and an absolute respect for the English language. The gift of communication is a precious commodity and the rewards is priceless. Regardless the venue, writing is an essential tool that should be used to create clear, concise and accurately described pictures for the mind's eye. Some of the services that I provide to my clients:Article writingCreative writingAcademic writingPress ReleasesArticle SubmissionForum PostingBlog CommentingGuest BloggingIf I missed anything, please email me to know more about me..... ",Mehreen Ali,2017-02-28,20.0,"April 30, 2013",,https://www.upwork.com/freelancers/_~01fe7d96a729512946,,0.0,upworkResourceCSV_10k_1.csv,
6797,https://odesk-prod-portraits.s3.amazonaws.com/Users:pandeurvashi:PortraitUrl_50?AWSAccessKeyId=1XVAX3FNQZAFC9GJCFR2&Expires=2147483647&Signature=RWtikocCnrMAV4DLfvW4v3tuco4%3D&1487266119848681,Writing,Independent,"Content creator -  Web content, blogs, marketing communications",,United States,"I am a business professional with ten plus years of industry experience and a post graduate degree in Marketing.  I bring to my work assignments many years of experience in real business situations, Finance and Accounting experience, excellent language skills, discipline and work ethic. I have written on business topics as well as life matters. My business-related writing includes research papers, marketing plans and interviews.  My blogs have been published in international publications. I am accustomed to delivering on deadlines. ",Urvashi Pande,2017-02-28,15.0,"August 17, 2016",1,https://www.upwork.com/freelancers/_~013f713955cbcb30c2,,0.0,upworkResourceCSV_10k_16.csv,
9218,https://odesk-prod-portraits.s3.amazonaws.com/Users:thewordsmith01:PortraitUrl_50?AWSAccessKeyId=1XVAX3FNQZAFC9GJCFR2&Expires=2147483647&Signature=qJ2dloFM7VwSshKf2YNbpVqHqMw%3D&1487647555004506,Writing,Independent,Copywriter and Content writer,seo-writing--copywriting--sales-letters--newsletter-writing--resume-writing--blog-writing--content-writing--article-writing--article-rewriting,Nigeria,"I am a B.A holder in English and Literature Studies from the University of Nigeria, Lagos. English Language is my official language and with over five years experience working in the Public Relations unit of a top Nigerian financial institution, I have gathered a wealth of experience, professionalism and expertise to deliver on various writing services. I have always been an ardent reader even from an early age.. I began writing solid and quality articles even before my high school days and friends and colleagues are usually amazed at my ease with words. I make extra effort when delivering any writing projects and always ensure they are error free and tailored to fit the service request. I am fast,detailed and meticulous and promise to deliver only excellent work. I hope to work with you on your writing projects soon.",Kalu Udeagha,2017-03-01,10.0,"February 21, 2017",,https://www.upwork.com/freelancers/_~01d4690b0c479af189,,0.0,upworkResourceCSV_10k_17.csv,
10282,https://odesk-prod-portraits.s3.amazonaws.com/Users:ryunosuke-ad:PortraitUrl_50?AWSAccessKeyId=1XVAX3FNQZAFC9GJCFR2&Expires=2147483647&Signature=QgIsByZrmylOIrpoluTdfzupCLo%3D&1474879061568900,Sales & Marketing--Translation--Writing,Independent,"Translator (EN-JP, IT-JP), Japanese Online Marketer",google-adwords--seo--facebook-marketing--translation-english-japanese--translation--japanese--seo-writing--writing--subtitling--yahoo-search-marketing,Netherlands,"I am a Japanese native, who has 5+ years experience in EN-JP, IT-JP translation with 3+ years of Online Marketing working experience.I am specialized in translation of the fields such as:- E-commerce Website- App Description- In-app text- In-Game text (MMORPG)- Game Subtitling- Instruction (Gaming Development Software, Working Manual, etc)- Marketing Webinar Subtitling- and more...As a Search Engine Marketing specialist, I have paid the main role in managing a high-volume account (30,000/month) and several support roles in managing/optimizing the smaller accounts of wide-ranging industries.As a Content Writer, I have been provided the articles to various industries such as, but not limited to the web media companies, non-profit organizations, and the individuals who need blog posts, and so on. The categories of my articles range over several kinds: travel, culture, marketing, business, entertainment, life-hack, and so on.",Ryunosuke M.,2017-03-01,20.0,"September 26, 2016",,https://www.upwork.com/freelancers/_~013a7f6bf1173691d3,,5.0,upworkResourceCSV_10k_18.csv,
14260,https://odesk-prod-portraits.s3.amazonaws.com/Users:annamlodhi:PortraitUrl_50?AWSAccessKeyId=1XVAX3FNQZAFC9GJCFR2&Expires=2147483647&Signature=QOHsWodcJ3HmP1S81wcfISQuCyU%3D&1478471740113348,Writing,Independent,Writer / Editor / Proofreader,feature-writing--satire--copy-editing--english-proofreading--seo-writing--news-writing-style,United Arab Emirates,"I am an enthusiastic, focused and organised journalist who specializes in field reporting. I have worked on some very intriguing topics in the hostile conditions of Pakistan, where I have researched, written and edited topics on national and international politics, the arts, new media and popular culture among other things.As the reporter for Pakistan Today (Lahore), I managed daily news, edited reports, and designed daily pages along with reporting. I have a strong PR and have many contacts in Pakistan.My writing is published regularly in Pakistan Today, Parhlo.com, and The Friday Times among others.",Annam Lodhi,2017-02-15,30.0,"November 6, 2016",1,https://www.upwork.com/freelancers/_~014379081de45346c6,1,0.0,upworkResourceCSV_10k_20.csv,
8664,https://odesk-prod-portraits.s3.amazonaws.com/Users:bconee:PortraitUrl_50?AWSAccessKeyId=1XVAX3FNQZAFC9GJCFR2&Expires=2147483647&Signature=wwgOZLUbYUISXuPcVOsTbW%2FmXVo%3D&1487352895955951,Writing,Independent,Copywriter and Editor,copywriting--creative-writing--social-media-marketing--editing,United States,"My name is Bridget and Im a copywriter. I received my Bachelors of Arts from the University of Notre Dame and my Masters of Arts from the University of Pittsburgh.  After being in the legal sector for a couple of years, I decided to follow my passion for writing and get my Diploma in Copywriting from the Blackford Centre (UK).I have experience writing for different audiences and in different tones, whether it be for a blog, a research paper, a book review, web content or press release.  I also have experience editing academic papers and legal content.I am passionate about getting your message across!-I offer fair price for my services.-I want to increase your sales and boost brand awareness for your company in an engaging and memorable way-I write in a clear and concise style that can be adapted to suit any subject-I want to create something that your business can not only be proud of, but that will immediately prove profitable and beneficial to your organization",Bridget Nee,2017-02-28,20.0,"February 17, 2017",,https://www.upwork.com/freelancers/_~01a3a8f49dd64ac930,,0.0,upworkResourceCSV_10k_17.csv,
2715,https://odesk-prod-portraits.s3.amazonaws.com/Users:meganjoy:PortraitUrl_50?AWSAccessKeyId=1XVAX3FNQZAFC9GJCFR2&Expires=2147483647&Signature=rquJE%2BdA2pg9Hgp5kH8MyXxSozw%3D&1437400302721061,Translation--Writing--Admin Support,Independent,Writing and editing for varied formats ,wordpress--content-writing--microsoft-excel--microsoft-powerpoint--microsoft-word--computer-skills--microsoft-outlook--business-writing--translation-english-spanish--editing,United States,"Multidisciplinary writer and editor with experience writing web copy, reports and other business documents, academic papers, and articles, as well as blogging and creating marketing materials. Provides smooth and accurate translation of documents from Spanish to English or vice-versa. ",Megan Moran,2017-03-02,10.0,"August 30, 2013",7,https://www.upwork.com/freelancers/_~015950172d32a8b93d,5,5.0,upworkResourceCSV_10k_1.csv,
15296,https://odesk-prod-portraits.s3.amazonaws.com/Users:mlamaiz:PortraitUrl_50?AWSAccessKeyId=1XVAX3FNQZAFC9GJCFR2&Expires=2147483647&Signature=1cwln0SfgcHcOzhUS4W0Yk6mNlg%3D&1468432438125523,"Design & Creative--Web, Mobile & Software Dev--Sales & Marketing--Admin Support--Writing",Independent,Skilled Web Developer,adobe-photoshop,Netherlands,achieve the top of the Web :P,M L.,2017-03-02,25.0,"May 31, 2008",,https://www.upwork.com/freelancers/_~01a1d71a022e496a49,1,4.5928763729,upworkResourceCSV_10k_24.csv,
5509,https://odesk-prod-portraits.s3.amazonaws.com/Users:tinafm:PortraitUrl_50?AWSAccessKeyId=1XVAX3FNQZAFC9GJCFR2&Expires=2147483647&Signature=lDd4mZuLKOSo7yEfsmbK6KzXAQQ%3D,Writing,Independent,Content Writer and Public Relations Strategist,article-writing--proofreading--translation--translation-english-romanian--translation-romanian-english--romanian--editing--public-relations--social-media-management,Romania,"I am a writer, book editor, certified translator and public relations strategist.. with more than a decade of professional experience, and an educational background in Philosophy, Political Studies, English Literature, Human Resources, Cinematic Arts and Business Communications. I am also one of the co-founders of Picozu, the HTML5 Image Editor and responsible for the application's web content and PR strategies.I took classes on the following topics: Organizational Communications, Human Resources Inspector, the Language of Hollywood: Storytelling, Sound, and Color, Child Nutrition and Cooking, Competitive Strategy, Nutrition, Health, and Lifestyle: Issues and Insights, Revolutionary Ideas: An Introduction to Legal and Political Philosophy.I have an extensive experience with anything related to writing, from simple articles to academic papers, e-books or corporate stories, in a wide variety of niches, such as: philosophy, history, literature, public relations, health, nutrition, medicine, natural remedies, weight loss, fitness, cinematic arts, wildlife removal and control, interior design, fashion, personal styling, house maintenance, dentistry, cloud computing, IT, new media, social media, and many others. In terms of corporate writing, I am proficient in developing any kind of online content, from newsletters to terms and conditions or website reviews, and also public relations and digital marketing strategies, and other types of brand identity writings. My writing style is always compliant with the needs of my clients and the needs of their target audiences, all my writings are proofread and ready to be used, and deadlines play an important role when developing my writing schedule. Please dont hesitate in contacting me with any questions you might have about my previous experience or about coming up with a plan for your projects.",Tina S.,2017-03-02,29.0,"October 3, 2013",12,https://www.upwork.com/freelancers/_~016aacd57566bbca9a,9,4.9666957413,upworkResourceCSV_10k_16.csv,
13795,,Engineering & Architecture--Writing--Admin Support,Independent,Expert Technical Writer,proofreading--editing--article-rewriting--content-writing--press-release-writing--blog-writing--typing,India,"With 15 years experience in civil engineering industry and 7 years of freelance experience of the content writing field, I am best equipped to provide services to clients.  I have written articles on topics as diverse as health, insurance, laptops, mobiles, graphic imaging, online gaming, and many more. With such exhaustive experience, I feel I can take on any project and complete it successfully.As if this is not enough, I have also written all types of content including product descriptions, testimonials, press releases, technical content, travel articles, etc.",Harish Desai,2017-02-20,11.0,"November 30, 2013",14,https://www.upwork.com/freelancers/_~01fee8bda606fccde0,1,0.0,upworkResourceCSV_10k_2.csv,
1653,https://odesk-prod-portraits.s3.amazonaws.com/Users:ben-fletcher:PortraitUrl_50?AWSAccessKeyId=1XVAX3FNQZAFC9GJCFR2&Expires=2147483647&Signature=LvsRXGl%2BmvoZ14FPa28QyuEL3ck%3D&1487540333290457,Writing,Independent,"Creative writer, poet, sports journalist, and editor.",creative-writing--journalism-writing--wordpress--copywriting--copy-editing--proofreading--grant-writing--blog-writing--content-writing--content-creation,United States,"Possessing a Bachelor of Arts in Writing and Publication with a minor in Mass Communications, I have both a penchant for and experience in writing within a myriad of mediums. As a contributing author, published journalist, poet, blogger, and songwriter, I find immense joy in creating and working with words in general, testing the limits of linguistic possibilities. In addition to extensive experience in creative writing, I've also served as both a writer and editor for an online newspaper, copy-edited a manuscript, and drafted grant proposals. Having learned under the tutelage of long-time Atlanta Journal-Constitution contributor, Ron Martz, you would be hard-pressed to find someone more prepared for such work. I believe that my training and experience in these areas throughout college, as well as my attention to detail and natural penchant linguistics in general, lends itself to this position. Additionally, I take criticism well, am easy to work with, and always strive to produce quality work. Since graduating in 2014, I have written for two sports websites, developed creative content for and edited the online newsletter for an international company, and begun a short story. Aside from writing, I love to mentor and encourage youth, especially those who face socioeconomic or family hardship.",Ben Helton,2017-03-01,15.0,"February 19, 2017",,https://www.upwork.com/freelancers/_~016a683bb707dcb979,,0.0,upworkResourceCSV_10k_0.csv,
5484,https://odesk-prod-portraits.s3.amazonaws.com/Users:pavloscpl:PortraitUrl_50?AWSAccessKeyId=1XVAX3FNQZAFC9GJCFR2&Expires=2147483647&Signature=zQsSQ3y0rb%2FIvLNCQ1BVFdd6uXE%3D&1481871110273669,"Writing--Translation--Admin Support--Web, Mobile & Software Dev--Design & Creative",Independent,Freelancer-Virtual Assistant-Translator,translation--translation-greek-english--travel-planning--data-entry--internet-research--google-searching--aviation--article-writing--virtual-assistant,Greece,"-Bachelor degree in civil infrastructure engineering -Bachelor degree in Education-MSc Environmental Engineering-Student pilot!I work as freelancer virtual assistant and translator. I can help you with:-translation projects (Greek to English and vice versa)-voice overs-creating presentations-transcriptions-organizing trips and booking flights/hotel etc-data entries-typewriting-web research-social media profiles,scheduled posts etc-article writingMy number one priority is to satisfy my client's needs. I am task oriented with strong organization skills, available anytime for my client and always ready to provide professional work meeting my client's requirements and deadlines.I keep on learning new skills in order to 100% satisfy my clients's needs ",Pavlos Panagiotopoulos,2017-03-01,10.0,"September 27, 2016",9,https://www.upwork.com/freelancers/_~016a915d79ef146c3c,1,4.950862069,upworkResourceCSV_10k_16.csv,
9487,https://odesk-prod-portraits.s3.amazonaws.com/Users:dpostlewaite:PortraitUrl_50?AWSAccessKeyId=1XVAX3FNQZAFC9GJCFR2&Expires=2147483647&Signature=bc84TjgdTUoqaBrscQX2w%2BmZQ1A%3D&1476909711194227,Admin Support--Writing,Independent,Online Contractor,creative-writing--internet-research--english-tutoring--lesson-plan-writing,United States,"Dedicated educator with a proven track record of commended teaching performance both in the classroom and online.  I have a passion for education and an unwavering commitment to optimizing student and school success.More than 4 years of online teaching experience and 2 years of classroom experience. I graduated from California University of Pennsylvania in 2012, earning a Masters degree in Teaching Social Studies at the Secondary Level.Notable experience in tutoring, blogging and freelance writing.",Derek P.,2017-03-01,14.0,"August 26, 2009",1,https://www.upwork.com/freelancers/_~01fc5e60ae144b09e1,7,5.0,upworkResourceCSV_10k_18.csv,
17284,https://odesk-prod-portraits.s3.amazonaws.com/Users:bryanfoat:PortraitUrl_50?AWSAccessKeyId=1XVAX3FNQZAFC9GJCFR2&Expires=2147483647&Signature=qb266V85DmaopbOdr%2B9T5BCn3Qo%3D&1432314326724001,Accounting & Consulting--Customer Service--IT & Networking--Writing--Sales & Marketing--Admin Support,Independent,Article Writing &Translation- Eng & Span native,business-writing--translation-english-spanish--translation-spanish-english--spanish--financial-writing--article-writing--blog-writing--crm--saas--software-documentation,Argentina,"Ranked top 1% on Elance EXPECT THE BEST - Article writing, blogging, translations. High value-added, high-quality, original work. Dependable delivery: on time, every time.US born, raised and educated (33 years). BA in International Business from US university. Fully bilingual. Living in Argentina since 1998.Tested top 10% in English-Spanish translation. Tested top 20% on business writing, English spelling & grammar.My principal differentiating factors include a long history of international sales and experience in Latam, fluent English & Spanish and deep awareness of cultural and linguistic issues unique both to Latam and US markets, permitting me to add more value with my writing and translating. I am available for writing in Spanish or English on a wide variety of topics or making translations of many different types of documents to/from Spanish to/from English as I am fully fluent in both languages.",Bryan F.,2017-03-02,30.0,"September 2, 2013",11,https://www.upwork.com/freelancers/_~01fc46575fdee8d655,,4.9063045049,upworkResourceCSV_10k_6.csv,
1594,,Admin Support--Writing,Independent,"Podcast Publishing Assistant, Transcriptionist, Proofreader",transcription--proofreading--wordpress,Philippines,"What you say matters. To help you get your point across, I offer:Transcription services for your podcasts, webinars, coaching sessions, and interviews.Proofreading services for your blog/website articles.Podcast publishing services to make sure that your MP3s are tagged, blog posts are prepared, and audios/videos uploaded to your host and scheduled for launch.",danielle del rosario,2017-03-02,11.25,"May 14, 2009",,https://www.upwork.com/freelancers/_~0162c0a6f7795b0224,4,4.9123224385,upworkResourceCSV_10k_0.csv,
7020,https://odesk-prod-portraits.s3.amazonaws.com/Users:cmmiller07:PortraitUrl_50?AWSAccessKeyId=1XVAX3FNQZAFC9GJCFR2&Expires=2147483647&Signature=KmsypMXsLW7UH7Jz%2BC3Kwa47hyQ%3D&1441553389396336,Customer Service--Writing--Admin Support,Independent,Writer/Web Content Manager/Data Entry,article-writing--blog-writing--wordpress--reviews--product-descriptions--seo-writing--web-content-management--data-entry--virtual-assistant--customer-service,United States,"I am a native English speaking writer from Florida, U.S. To any client I work for I bring organization, dedication, leadership, hard work, perseverance, good communication, and phone skills. I am able to build rapport easily with my clients which helps to keep that repeat business. I am a quick learner and adapt easily to change with my client needs. I am able to work through technical issues with little to no difficulty. I don't have to be watched over constantly and I meet deadlines on time or early. I take pride and believe in myself and my work which helps me to be successful in everything I do. Taking pride in ones work is a strong work ethic and I am one that believes in that strongly. My writing range consists of, book reviews, web content, game reviews, entertainment, general articles, e-mails, niche writing, auto-response writing, and much much more. ",Christine Miller,2017-03-02,12.5,"February 22, 2010",3,https://www.upwork.com/freelancers/_~016b44f0a9a47d1518,3,4.9545535761,upworkResourceCSV_10k_17.csv,
5218,https://odesk-prod-portraits.s3.amazonaws.com/Users:ewiedeman:PortraitUrl_50?AWSAccessKeyId=1XVAX3FNQZAFC9GJCFR2&Expires=2147483647&Signature=Ba0PEAwejDvwqefjELVjJHpK3J8%3D&1433016139535926,Admin Support--Sales & Marketing--Writing--Accounting & Consulting,Independent,Motivated*Detail Oriented*Self-Starter,writing--event-planning--project-management--computer-skills--microsoft-word--iphone-app-development--public-relations--editing--customer-service--microsoft-outlook,United States,"Detail oriented, skilled with administrative duties, extensive event planning, project management, etc. Types 90WPM. Over 15 years experience with administrative duties, public communications, webpage updating, presentation software, writing, bookkeeping, budgeting and much more. ",Erin A.,2017-03-02,25.0,"May 22, 2014",,https://www.upwork.com/freelancers/_~01aa1e07707461d323,,5.0,upworkResourceCSV_10k_13.csv,
3966,https://odesk-prod-portraits.s3.amazonaws.com/Users:maggie50:PortraitUrl_50?AWSAccessKeyId=1XVAX3FNQZAFC9GJCFR2&Expires=2147483647&Signature=6Ea0SPKt0xzd4MwIJ%2ByRH2TuudQ%3D&1465894389835686,Writing--Admin Support,Independent,Distinguished Writer,seo-writing--business-proposal-writing--creative-writing--copywriting,South Africa,"I write, edit and provide final copies with distinction. I have a proven writing experience that is well established.",Maggie Mashivhege,2017-02-28,20.0,"June 14, 2016",1,https://www.upwork.com/freelancers/_~01636303915f4bc7f1,1,4.539137653,upworkResourceCSV_10k_1.csv,
