,portrait_50,categories2,profile_type,title,skills,country,description,name,last_activity,rate,member_since,portfolio_items_count,id,test_passed_count,feedback,filename,alreadyMessaged
14265,https://odesk-prod-portraits.s3.amazonaws.com/Users:abbykompare:PortraitUrl_50?AWSAccessKeyId=1XVAX3FNQZAFC9GJCFR2&Expires=2147483647&Signature=mhF51fTt2SI7z0xN9WZs7kmP9NA%3D&1488134215525270,Writing,Independent,Writer and Filmmaker,video-editing--website-development--creative-writing,Canada,"Hello there! I am a creative writer and filmmaker from Canada looking to help you pursue your projects! I have self published three novels over the years and am currently filming my second short film! If you are looking for help in the areas of creative writing or video editing, I would be more than happy to help you out! I will work with you and make sure the final result is exactly what you envisioned! Thank you for looking at my profile!",Abby Kompare,2017-02-26,12.5,"January 31, 2017",,https://www.upwork.com/freelancers/_~0132c06cd473540946,,0.0,upworkResourceCSV_10k_20.csv,
2365,https://odesk-prod-portraits.s3.amazonaws.com/Users:belleza_marianne:PortraitUrl_50?AWSAccessKeyId=1XVAX3FNQZAFC9GJCFR2&Expires=2147483647&Signature=GCOykmzDRYMXNrC4YiT3%2BDHwDLo%3D,Customer Service--Writing--Admin Support,Independent,Writing For A Living,article-writing--journalism-writing--creative-writing--editorial-writing--essay-writing--feature-writing--medical-writing--newsletter-writing--news-writing-style--non-fiction-writing,Philippines,"Hi! I'm a fresh graduate looking for a freelance job, specifically writing jobs, without any regards to the topic.I was part of our school paper staff during college, and also won several awards on editorial writing since my elementary years. English is my best language, and I could write decent, grammar-friendly write-ups.I am especially good at health and science related topics and can also do book reviews.",Marianne Belleza,2017-02-20,10.0,"December 10, 2014",,https://www.upwork.com/freelancers/_~01973905c654229c1f,4,5.0,upworkResourceCSV_10k_0.csv,
15757,https://odesk-prod-portraits.s3.amazonaws.com/Users:cameronlove:PortraitUrl_50?AWSAccessKeyId=1XVAX3FNQZAFC9GJCFR2&Expires=2147483647&Signature=Na%2FLDdGSjzri0e4ruew%2FwyehEMI%3D&1483498597908972,Writing,Independent,Freelancing Ghostwriter,writing--research--ghostwriting,United States,"I am a freelancer/ ghostwriter who is interested in any topic (I love to research and learn new things). There are a lot of topics I do not need to research though, as I know a great amount of information on them. Examples are listed but not limited to.* Animals, both exotic and common* Anime* Horror films* Colored hair care* Social media* Gaming systems",Cameron DeMonico,2017-03-01,10.0,"January 4, 2017",,https://www.upwork.com/freelancers/_~01245ec9dbe0dbcde2,1,0.0,upworkResourceCSV_10k_3.csv,
12000,,"Translation--Writing--Admin Support--Web, Mobile & Software Dev--Sales & Marketing",Independent,Have many skils,translation-english-turkish--content-writing--content-moderation--web-content-management--english-proofreading--english-tutoring--teaching-english--microsoft-office--mobile-app-testing--social-media-marketing,Turkey,"I am a student who studies american culture and literature.I have been dealing with computers and english language for many years so m good at them.And m good at internet social media,too.Because of my major at university,  am interested in literature,stories,novels, too",Okan Kaya,2017-02-15,15.0,"July 3, 2012",,https://www.upwork.com/freelancers/_~01658a9083f5047c4c,,0.0,upworkResourceCSV_10k_19.csv,
14963,https://odesk-prod-portraits.s3.amazonaws.com/Users:writer3005:PortraitUrl_50?AWSAccessKeyId=1XVAX3FNQZAFC9GJCFR2&Expires=2147483647&Signature=0QXEnCes7%2FjOc0YWhyRoR4Ml9qw%3D&1448462392341261,Writing,Independent,Creative Writer,article-writing--technical-writing--business-writing--press-release-writing--report-writing--journalism-writing--english-spelling--english-grammar--seo--copywriting,United Kingdom,"You want high quality and something exceptional on your project! So do I?""Excellent provider. Very thorough writer with attention to detail and knowledge of incorporating SEO. Also extremely fast turnaround. I hired him one night and by the next afternoon the articles were all written. Great work, would definitely hire again.""Excellent work! Delivered before the deadline and on budget. Fantastic job, would highly recommend.Articles were very well written and catchy, professional, responds quickly, and is easy to work with. Very content and would definitely work with again. Nice work! :)This was an urgent project for 11 articles on a specific medical condition. All articles were delivered on time (the writer had only 3 days to do the research and write the articles) and I was really happy with the quality of the research and writing. The writer's SEO skills are very solid and he always follows instructions to the letter. Overall - an excellent job!So feedback like these from several clients doesnt prove my quality and experience! In this circumstance, you are here for a specific need. You (or a client) have a product or service to promote and you must need a trustworthy and professional writer who will perform very well and provide the copy that will reach your standards. Finally, you need good results and you need them now, right?I am a British writer specialist in technical writing and creative writing for Web content, Blogs, SEO, Finance and Press release etc. I believe I would perform exceptionally in this position as I am knowledgeable, creative and my English is outstanding.I have had to write about a variety of different topics over the last 8 years. This displays my versatility when writing articles and believe that I'm experienced enough to complete a wide range of tasks to a high standard. When writing about a topic that I have been set, I am meticulous in my research methods to make sure that I produce the best work for my valued client.",Munir A,2017-03-02,22.0,"March 3, 2011",9,https://www.upwork.com/freelancers/_~0107ad02fefeb474ae,3,4.7298743837,upworkResourceCSV_10k_24.csv,
4301,https://odesk-prod-portraits.s3.amazonaws.com/Users:fairygada:PortraitUrl_50?AWSAccessKeyId=1XVAX3FNQZAFC9GJCFR2&Expires=2147483647&Signature=oA4XoKURzZks62Acuo%2FyQLvSYQw%3D&1485672793130923,Writing--Design & Creative--Admin Support--Accounting & Consulting,Independent,Financial Analyst/ Writer,financial-analysis--financial-writing--economics--equity-research--investment-research,India,"I offer research and writing service in finance domain. I write research reports, news articles, other general conceptual articles, blogs, e-books on finance and business related topics. This includes - equity research, financial securities and products review, personal finance, saving and investing, insurance, mutual funds, economic analysis, entrepreneurship, etc.Having worked with international clients, who require content for global audience as well as from their respective countries, I have grounding on foreign economies and investment environment.",Fairy Gada,2017-03-02,12.5,"August 26, 2013",1,https://www.upwork.com/freelancers/_~014bc55aead1666d7b,,4.2259165745,upworkResourceCSV_10k_1.csv,
13350,https://odesk-prod-portraits.s3.amazonaws.com/Users:drdaliaf:PortraitUrl_50?AWSAccessKeyId=1XVAX3FNQZAFC9GJCFR2&Expires=2147483647&Signature=iRQJIIzPiA3TknGc6rx9wwZXDlo%3D&1478024179912143,Translation--Writing,Independent,"English-Arabic medical and general translator, Arabic Writer",medical-translation--translation-english-arabic--translation-arabic-english--article-writing--proofreading--editing--creative-writing--counseling-psychology,Egypt,"I was born in Egypt, and as a child I was raised in the US. I'm a physician with a passion for writing.I translate from English to Arabic and vice versa, so If you're looking for a freelancer with expertise in English to Arabic translation, including general and medical translation, then you've found what you're looking for. Also if you're in need for an Arabic article writer and editor, you will certainly be pleased with my work.I'm disciplined, organized and masterly. Fell free to contact me",Dalia Fouad,2017-03-01,10.0,"October 27, 2016",5,https://www.upwork.com/freelancers/_~01d1796156654c00b3,1,0.0,upworkResourceCSV_10k_2.csv,
7452,https://odesk-prod-portraits.s3.amazonaws.com/Users:caylamcdonald:PortraitUrl_50?AWSAccessKeyId=1XVAX3FNQZAFC9GJCFR2&Expires=2147483647&Signature=m0ZhxDxCHG%2Be3Jjq2N%2Fwpheu2bA%3D&1461385163388363,Writing--Sales & Marketing,Independent,Writer | Editor | Proofreader ,editing--proofreading--product-descriptions--creative-writing--sales-writing--copywriting--copy-editing--ghostwriting--letter-writing--email-etiquette,United States,"Ready for a professional writer or editor to take your work to the next level? Let's connect. I specialize in the following areas, but I'm always up for a challenge: Editing | Proofreading | Product Descriptions | Sales Writing | Creative Writing | Web Copy | Ghostwriting | Social Media Posts | Emails & Letters",Cayla McDonald,2017-03-02,22.0,"August 14, 2011",,https://www.upwork.com/freelancers/_~019e38d6d1cb6353f9,3,4.9323352899,upworkResourceCSV_10k_17.csv,
5626,https://odesk-prod-portraits.s3.amazonaws.com/Users:pioferreras:PortraitUrl_50?AWSAccessKeyId=1XVAX3FNQZAFC9GJCFR2&Expires=2147483647&Signature=eGTjRSqnKe%2BxSjC0Mo9ca94tmSU%3D&1477881695148221,Writing,Independent,Video game website writer,article-writing--blog-writing--content-writing--creative-writing--seo-writing--english--internet-research,Philippines,"I am a freelance writer specializing in video game news, reviews, opinions and other video game-related articles. All my works are 100 percent original and non-plagiarized. I can provide links to my works as needed. Most of which are credited under my name.My clients rarely have to edit my articles (except for website-specific formatting). I produce them in ready-to-go status. Meaning, you dont have to spend additional money on a proofreader to meticulously check my work.I can write any type of video game-related content, which include:1) News articles  Most of my works are in this category. I can build on breaking news, rumors and speculations. And to make my news articles more unique than others, I include my own commentary and opinion.2) Opinion articles  I can write in a biased or unbiased way, and paint the topic in a positive or negative light. Whatever angle you prefer, I can adjust my writing style accordingly.3) Reviews  You can count on me to produce well-researched and in-depth reviews for any game, regardless of gaming platform or genre. 4) Listicles  I can write the descriptions for each item in long form or short form, depending on your preference. I can publish my own works with minimal supervision. It can be on Wordpress or a custom Content Management System. All you need to do is review my Draft.Here are a few testimonials from past clients:""Pio is your right choice for any long-term writing contracts, especially in the gaming industry!""""He was a pleasure to work with, and I would order from him again. I recommend him to anyone looking for a writer with extensive videogame knowledge.""""His communication via chat was always very friendly and polite. He understood every instruction quickly.""""Pio's English was perfect, not just good, but perfect. I'm from America and I think his writing is better than mine.""""Pio has been wonderful to work with. He always turned in his assignments on time and his communication with me on the gaming articles he wrote for us could not have been better.""If youre looking to produce top quality content for your video game website, just give me a message and let's take it from there.",Pio Ferreras,2017-03-02,20.0,"June 28, 2015",,https://www.upwork.com/freelancers/_~0167b08a81b4829e82,10,4.8132502751,upworkResourceCSV_10k_16.csv,
8299,https://odesk-prod-portraits.s3.amazonaws.com/Users:elodis:PortraitUrl_50?AWSAccessKeyId=1XVAX3FNQZAFC9GJCFR2&Expires=2147483647&Signature=%2BQlMJdF4pxC8G%2Fp9P8rvXyT9E6o%3D&1487345686995226,Translation--Writing--Accounting & Consulting,Independent,Translator,microsoft-connect--adobe-photoshop--sony-vegas--email-handling--microsoft-word--microsoft-excel--microsoft-powerpoint--translation-portuguese-english--translation-english-portuguese--proofreading,Portugal,"I am a young adult with really high standards. Studied Psychology and despite not finishing the degree I can safely say I've gathered lots of experience and skills. I have always felt confortable with the english language and recently from a job experience I gathered some knowledge in spanish.Writing is also one of my passions and it's something I've always done, for friends, websites, blogs or just random texts. Contact me for some good work and dedication. ",David Pereira,2017-02-24,15.0,"February 17, 2017",,https://www.upwork.com/freelancers/_~0155db26f695c26cf9,1,0.0,upworkResourceCSV_10k_17.csv,
9956,https://odesk-prod-portraits.s3.amazonaws.com/Users:borismex:PortraitUrl_50?AWSAccessKeyId=1XVAX3FNQZAFC9GJCFR2&Expires=2147483647&Signature=vPU7GJvZMkCM1o6mbwYYCJA46Gk%3D&1464719974857579,Translation--Sales & Marketing--Design & Creative--Customer Service--Admin Support--Writing,Independent,Fully Licensed M.D. / English Spanish Medical Interpreter Proofreader,proofreading--spanish--translation-english-spanish--medical-writing--medical-records-research--internet-research--audio-mixing--audio-editing,Mexico,"Don't be afraid of my hourly rate! Please keep reading, perhaps I might be your perfect contractor:TOEFL-ITP certified with 613pts, and probably Upwork's FASTEST english-spanish translation contractor, with a speed of up to 3420 words per hour (this speed is ONLY GUARANTEED at a HIGHER hourly rate of 52.22 and so long as the topics to be translated are not too technical) and an ultra-fast turn-around time, I can translate a 90-page book in 12 hours. Of course, I DO NOT USE any kind of online or installed translating machine/tool. 100% human translation only, GUARANTEED. I you have a close & tight deadline, I can guarantee you my speeds at my current hourly rate. Otherwise, I can adjust my rate in depth according to your needs.Perfect Grammar... Perfect Spelling... Perfect Spanish... Vast Experience with Medical & Legal Terminology. The M.D. is a plus!""First Impression is the Last Impression!""There's nothing worse than having one of your potential customers find your poorly translated website full of horrible spanish spelling errors. You'll lose your most valuable and potentially loyal customers forever! Don't let Google Translate's automatic translating machine ruin your company's reputation!I'm Committed with Quality in Customer and After-Sales Service, as well aswith pursuit of Perfection in every Project I get involved into. Alwaysseeking for the Development and Enhancement of my personal abilities, so that I can cooperate with innovative ideas, towards the growth of myself and my company, ""Entrepreneurship is my middle Name"".",Boris Marcelo Ore Vasquez,2017-03-02,19.0,"January 27, 2010",4,https://www.upwork.com/freelancers/_~018f5edb9d615671f4,13,4.6939916521,upworkResourceCSV_10k_18.csv,
4977,https://odesk-prod-portraits.s3.amazonaws.com/Users:lummen:PortraitUrl_50?AWSAccessKeyId=1XVAX3FNQZAFC9GJCFR2&Expires=2147483647&Signature=bDlwzLIY%2BkAzqkOrprxQjURRxJM%3D&1443088267988576,Sales & Marketing--Translation--Design & Creative--Writing,Independent,English-Polish Translator/ Copywriter,writing--seo-writing--creative-writing--creative-and-talent--translation--public-speaking--translation-english-polish--translation-polish-english,Poland,"For years I have been translating various documents in both English and Polish, including: EU, history, gaming, IT, art, education, psychology, sociology, etc. I am creative, hard working and reliable.",Ewelina Wiznerowicz,2017-02-25,30.0,"September 24, 2015",,https://www.upwork.com/freelancers/_~01c682650a11619e89,,4.9845770369,upworkResourceCSV_10k_1.csv,
16674,https://odesk-prod-portraits.s3.amazonaws.com/Users:daveuwak:PortraitUrl_50?AWSAccessKeyId=1XVAX3FNQZAFC9GJCFR2&Expires=2147483647&Signature=00ym%2F1jfkziJZkBwYxnwzp3e7OQ%3D&1450211970040872,Writing,Independent,"Copywriter, translator, proofreader.",research--wordpress--seo--data-analysis--creative-writing--editing--copywriting--proofreading--content-writing--translation,United Kingdom,"I am a natural writer with a deft turn of phrase and a clinical eye for proofreading. Holding a postgraduate degree in English and currently pursuing a second masters in political economy, I have a strong background in academic research, as well as 5 years experience in copywriting, proofreading, and translation. References:  Ive seen talented writers before, but rarely have I met writers that are also bona fide thinkers able to make sense of the world. Two thumbs up for Dave! - Paul Dabrowski, CDP GroupLinkedin:""Dave is a very good professional. He has done some very good editing, proofreading and translation services for me, I can recommend his expertise in scientific publishing and skills in english, spanish and catalan translation"" - Juan A. Barcelo, lecturer, UABHe has worked with us on newsletters, web texts, press notes and educational content that we create. He is quick, reliable and the quality of his work is always very high."" - Aleksandra Zemke, Smilemundo",Dave U.,2017-03-02,15.0,"June 29, 2015",5,https://www.upwork.com/freelancers/_~01b42f4f47de07f9c8,,0.0,upworkResourceCSV_10k_34.csv,
9255,https://odesk-prod-portraits.s3.amazonaws.com/Users:b_skeen:PortraitUrl_50?AWSAccessKeyId=1XVAX3FNQZAFC9GJCFR2&Expires=2147483647&Signature=Z9vol0tv%2FXH%2BR0iYKLDxakx08MA%3D&1488419119436747,Writing,Independent,Independent Writer and Researcher,gimp--greek--wiki--e-pub-formatting,United States,"I have professional training in history and classics (Greek & Latin Literature) and began my career as a college professor.For the last ten years I have worked as a freelance writer, publishing over half a million words for reference and textbook publishers like Gale and Facts on File. I also have several peer-reviewed publications in scholarly journals.I am an experienced professional and you can expect professional behavior from me in terms of dead-lines, self-directed work, and the highest levels of English competency.",Bradley Skeen,2017-03-02,15.0,"February 15, 2017",,https://www.upwork.com/freelancers/_~01b045f2a891be966d,,0.0,upworkResourceCSV_10k_17.csv,
11918,https://odesk-prod-portraits.s3.amazonaws.com/Users:laurspre:PortraitUrl_50?AWSAccessKeyId=1XVAX3FNQZAFC9GJCFR2&Expires=2147483647&Signature=R82cTbJr1%2FzliIJTbPE3hYSlu0o%3D&1487090329101407,Writing,Independent,Academic Reasearch Writer and Proofreader,copy-editing--english-proofreading--newsletter-writing--recipe-writing--research-papers--internet-research--operations-research--web-design,United States,"I have a BBA in Management Information Systems, and work experience in the Construction Operations and Aerospace industries. I have extensive knowledge in Supply Chain strategy, and am self-educated on many other topics I am passionate about. These topics include Mental Health, Nutrition, and Psychology.",Lauren Sprenger,2017-03-02,15.0,"February 13, 2017",,https://www.upwork.com/freelancers/_~01e7bd2815dc4b0e73,,0.0,upworkResourceCSV_10k_19.csv,
13713,https://odesk-prod-portraits.s3.amazonaws.com/Users:jfredel78:PortraitUrl_50?AWSAccessKeyId=1XVAX3FNQZAFC9GJCFR2&Expires=2147483647&Signature=y%2F2SdQk7a3O%2Bd1%2FmFxR4hcVHI1g%3D&1487447790997970,Writing,Independent,Freelance Content Writer and Proofreader,film-criticism--academic-writing--english-proofreading,United States,"I am a fourth-year undergraduate at the University of Minnesota due to graduate in May. My multi-faceted Liberal Arts education has given me a broad range of writing experience, in addition to my excellent command of the English language as a native speaker and writer.",Jacob Fredel,2017-02-25,15.0,"February 18, 2017",,https://www.upwork.com/freelancers/_~016ad101014f9eaf5d,,0.0,upworkResourceCSV_10k_2.csv,
6627,https://odesk-prod-portraits.s3.amazonaws.com/Users:ethanjacobs:PortraitUrl_50?AWSAccessKeyId=1XVAX3FNQZAFC9GJCFR2&Expires=2147483647&Signature=5NpI5cx6jshfxnrp5EMA6PrrLgA%3D&1482345177242954,Translation--Writing,Independent,"Academic Writer, Researcher, Editor, and Translator",wordpress--microsoft-word--research--english-grammar--report-writing--translation-spanish-english,Colombia,"Youre looking to contract a writer.  You need someone capable of lighting up a page with wording that sizzles and pops before a readers eyes like multi-character lardons in a word processing skillet.  By the same token-- you want value for your money.  Nobody enjoys forking over valuable capital in exchange for haphazardly completed final project, nor do they want to work with someone who lacks the chops, punctuality or professionalism to adequately complete a job on a consistent basis.  I think I can be of service to you.A graduate from Boston Colleges college of Arts and Sciences, I hold a degree in Philosophy with a minor in Economics.  My professional writing experience spans six years and ranges in roles from editing for grammar and tweaking wording in scholarly articles and academic term papers to providing resume critiques and cover letter composition workshops.  Beyond this, I have drafted speeches as well as research-intensive summaries and reports  for consulting firms and even post blogs and write-ups of my own when I find a few spare moments.My writing style is best described as accessible academia, as I make a concerted effort to synthesize seemingly complex issues in a way that readers can digest seamlessly.  Im deadline-driven and always try my best to make myself amenable to the needs of those with whom I work.  I see that youre still reading this, which means youre either engrossed or unconvinced.  If its the latter, regrettably, we probably wont be able to collaborate.  If its the former, what are you waiting for?  Lets get to work!",Ethan Jacobs,2017-03-01,25.0,"November 9, 2016",1,https://www.upwork.com/freelancers/_~01ee911087e863d2bb,4,4.75,upworkResourceCSV_10k_16.csv,
11524,https://odesk-prod-portraits.s3.amazonaws.com/Users:c-now:PortraitUrl_50?AWSAccessKeyId=1XVAX3FNQZAFC9GJCFR2&Expires=2147483647&Signature=DKGVVCT6wiZCH9uJZ1CAP5BPwvg%3D&1487550713553626,Writing,Independent,Doctor.Chemist.Mom,medical-writing--research-papers--poster-design--transcription,Canada,"I am a medical school graduate with a background in chemistry, recently turned stay-at-home mom.  With time to spare during nap times and evenings I would like to keep myself busy with a little work.  I have experience with research paper writing, academic poster design and presentation, as well as medical knowledge that should be put to good use.  If you require anything done quickly, from preparing for a conference (poster or presentation), editing, writing a paper, or transcription, I'm available.",Catherine Nowierski,2017-03-01,25.0,"August 17, 2016",,https://www.upwork.com/freelancers/_~01ff1645d19f7b96da,,0.0,upworkResourceCSV_10k_19.csv,
